0,WNDEF MIXED DRINK,*,*,Made of two or more ingredients.,wndefs11.aiml
0,WNDEF FAMOUSLY,*,*,In a manner or to an extent that is well known.,wndefs11.aiml
0,WNDEF DECOMPOSE,*,*,Break down; Separate (substances) into constituent elements or parts.,wndefs11.aiml
0,WNDEF CONCAVELY,*,*,In a concave way.,wndefs11.aiml
0,WNDEF PATHETICALLY,*,*,In a manner arousing sympathy and compassion.,wndefs11.aiml
0,WNDEF VAISYA,*,*,A member of the mercantile and professional Hindu caste; the third of the four main castes; The third of the four varnas.,wndefs11.aiml
0,WNDEF CAPE BUFFALO,*,*,Large often savage buffalo of southern Africa having upward-curving horns; mostly in game reserves.,wndefs11.aiml
0,WNDEF CHOP SHOP,*,*,A place where stolen cars are disassembled for their parts.,wndefs11.aiml
0,WNDEF BRITISH POUND,*,*,The basic unit of money in Great Britain; equal to 100 pence.,wndefs11.aiml
0,WNDEF ASCLEPIADACEOUS,*,*,Of or relating to plants of the milkweed family.,wndefs11.aiml
0,WNDEF SLOE GIN,*,*,Gin flavored with sloes (fruit of the blackthorn).,wndefs11.aiml
0,WNDEF AMIDSHIP,*,*,Located in the middle part of a ship or aircraft; At or near or toward the middle.,wndefs11.aiml
0,WNDEF EAST MIDLAND,*,*,The dialect of Middle English that replaced West Saxon as the literary language and which developed into Modern English.,wndefs11.aiml
0,WNDEF ATTAINDER,*,*,Cancellation of civil rights.,wndefs11.aiml
0,WNDEF HUNGARY,*,*,A republic in central Europe.,wndefs11.aiml
0,WNDEF TONSURE,*,*,Shave the head of a newly inducted monk; Shaving the crown of the head by priests or members of a monastic order; The shaved crown of a monk's or priest's head.,wndefs11.aiml
0,WNDEF KANNADA-SPEAKING,*,*,Able to communicate in Kannada.,wndefs11.aiml
0,WNDEF FOREIGNER,*,*,A person who comes from a foreign country; someone who does not owe allegiance to your country; Someone who is excluded from or is not a member of a group.,wndefs11.aiml
0,WNDEF GOLDEN RULE,*,*,Any important rule; A command based on Jesus' words in the Sermon on the Mount.,wndefs11.aiml
0,WNDEF HALF-HEARTEDLY,*,*,Without enthusiasm; in a half-hearted manner.,wndefs11.aiml
0,WNDEF NATURAL IMMUNITY,*,*,Immunity to disease that occurs as part of an individual's natural biologic makeup.,wndefs11.aiml
0,WNDEF SANTALALES,*,*,Order of plants distinguished by having a one-celled inferior ovary; many are parasitic or partly parasitic usually on roots.,wndefs11.aiml
0,WNDEF ALTRUISTIC,*,*,Showing unselfish concern for the welfare of others.,wndefs11.aiml
0,WNDEF AMAZING,*,*,Inspiring awe or admiration or wonder; Surprising greatly.,wndefs11.aiml
0,WNDEF MAHUANG,*,*,Chinese ephedra yielding ephedrine.,wndefs11.aiml
0,WNDEF CESSION,*,*,The act of ceding.,wndefs11.aiml
0,WNDEF SODA LIME,*,*,A mixture of sodium and calcium hydroxides; absorbs liquids and gases.,wndefs11.aiml
0,WNDEF SHARPENED,*,*,Made something sharp or sharper; Having the point made something sharp.,wndefs11.aiml
0,WNDEF ELECTRIC DIPOLE,*,*,A dipole with equal and opposite electric charges.,wndefs11.aiml
0,WNDEF PUMICE,*,*,Rub something with pumice#Comma in order to clean or to smoothen.,wndefs11.aiml
0,WNDEF BAZAAR,*,*,A sale of miscellany; often for charity; A street of small shops (especially in Orient); A shop where a variety of goods are sold.,wndefs11.aiml
0,WNDEF BUY BACK,*,*,Buy what had previously been sold#Comma lost#Comma or given away.,wndefs11.aiml
0,WNDEF HODEIDA,*,*,An important port in Yemen on the Red Sea.,wndefs11.aiml
0,WNDEF KEA,*,*,Large brownish-green New Zealand parrot.,wndefs11.aiml
0,WNDEF SLEEPING PILL,*,*,A soporific drug in the form of a pill (or tablet or capsule).,wndefs11.aiml
0,WNDEF SCARLET LETTER,*,*,The letter A in red; Puritans required adulterers to wear it.,wndefs11.aiml
0,WNDEF KEG,*,*,Small cask or barrel; The quantity contained in a keg.,wndefs11.aiml
0,WNDEF PRECIPITANT,*,*,An agent that causes a precipitate to form.,wndefs11.aiml
0,WNDEF PATROLLER,*,*,Someone on patrol duty; an individual or a member of a group that patrols an area.,wndefs11.aiml
0,WNDEF HUDSON,*,*,A New York river; flows southward into New York Bay; explored by Henry Hudson early in the 17th century; English navigator who discovered the Hudson River; in 1610 he attempted to winter in Hudson Bay but his crew mutinied and set him adrift to die (1565-1611); English naturalist (born in Argentina) (1841-1922).,wndefs11.aiml
0,WNDEF CLOVEN-HOOFED,*,*,Of or relating to the cloven feet of ruminants or swine.,wndefs11.aiml
0,WNDEF CALCIUM BLOCKER,*,*,Any of a class of drugs that block the flow of the electrolyte calcium (either in nerve cell conduction or smooth muscle contraction of the heart); has been used in the treatment of angina or arrhythmia or hypertension or migraine.,wndefs11.aiml
0,WNDEF INTERSTITIAL FLUID,*,*,Liquid found between the cells of the body that provides much of the liquid environment of the body.,wndefs11.aiml
0,WNDEF ROCKER,*,*,An ice skate with a curved blade; A performer or composer or fan of rock music; An attendant who rocks a child in a cradle; A curved support that permits the supported object to rock to and fro; A trough on rockers used by gold miners to shake earth in water in order to separate the gold; A teenager or young adult in the 1960s who wore leather jackets and rode motorcycles.,wndefs11.aiml
0,WNDEF ROCKET,*,*,Any vehicle self-propelled by a rocket engine; Propel something with a rocket; A jet engine containing its own propellant and driven by reaction propulsion; Propels bright light high in the sky#Comma or used to propel a lifesaving line or harpoon; Erect European annual often grown as a salad crop to be harvested when young and tender; Shoot up abruptly#Comma like a rocket.,wndefs11.aiml
0,WNDEF OFFSIDE,*,*,Illegally in advance of the ball or puck; Illegally beyond a prescribed line or area or ahead of the ball or puck.,wndefs11.aiml
0,WNDEF TASTEFULLY,*,*,With taste; in a tasteful manner.,wndefs11.aiml
0,WNDEF EXCEPTIONABLE,*,*,Liable to objection or debate; used of something one might take exception to.,wndefs11.aiml
0,WNDEF DEACTIVATE,*,*,Remove from active military status or reassign.,wndefs11.aiml
0,WNDEF BIOSYNTHESIS,*,*,Production of a chemical compound by a living organism.,wndefs11.aiml
0,WNDEF GLAUBER'S SALT,*,*,(Na2SO4 .10H2O) a colorless salt used as a cathartic.,wndefs11.aiml
0,WNDEF KEY,*,*,Pitch of the voice; A list of words or phrases that explain symbols or abbreviations; A list of answers to a test; Any of 24 major or minor diatonic scales that provide the tonal framework for a piece of music; A coral reef off the southern coast of Florida; A kilogram of a narcotic drug; Regulate the musical pitch of something; Vandalize a car by scratching the sides with a key; Provide something with a key; Metal device shaped in such a way that when it is inserted into the appropriate lock the lock's mechanism can be rotated; A lever that actuates a mechanism when depressed; Something crucial for explaining; A space (including the foul line) in front of the basket at each end of a basketball court; usually painted a different color from the rest of the court; United States lawyer and poet who wrote a poem after witnessing the British attack on Baltimore during the War of 1812; the poem was later set to music and entitled The Star-Spangled Banner (1779-1843); Harmonize something with or adjust to SOMETHING_2.,wndefs11.aiml
0,WNDEF NAILBRUSH,*,*,A brush used to clean a person's fingernails.,wndefs11.aiml
0,WNDEF GEOCENTRIC PARALLAX,*,*,The parallax of a celestial body using two points on the surface of the earth as the earth rotates.,wndefs11.aiml
0,WNDEF FISSURELLIDAE,*,*,Marine limpets.,wndefs11.aiml
0,WNDEF GALLFLY,*,*,Any of various insects that deposit their eggs in plants causing galls in which the larvae feed.,wndefs11.aiml
0,WNDEF ORDINARY ANNUITY,*,*,An annuity paid in a series of more or less equal payments at the end of equally spaced periods.,wndefs11.aiml
0,WNDEF SEMIMONTHLY,*,*,Twice a month.,wndefs11.aiml
0,WNDEF TEKTITE,*,*,Thought to derive from meteorites.,wndefs11.aiml
0,WNDEF SQUILLA,*,*,A kind of mantis shrimp.,wndefs11.aiml
0,WNDEF SCOURGE,*,*,A whip used to inflict punishment; Punish something severely; excoriate.,wndefs11.aiml
0,WNDEF SOUTH PACIFIC,*,*,That part of the Pacific Ocean south of the equator.,wndefs11.aiml
0,WNDEF SPROUT,*,*,A newly grown bud (especially from a germinating seed); Any new growth of a plant such as a new branch or a bud; Put forth and grow sprouts or shoots.,wndefs11.aiml
0,WNDEF VIRGINIA HAM,*,*,A lean hickory-smoked ham; has dark red meat.,wndefs11.aiml
0,WNDEF CLIMBING SALAMANDER,*,*,Any of several North salamanders - and long somewhat squared adapted for climbing with well-developed limbs off toes.,wndefs11.aiml
0,WNDEF SCOURER,*,*,Someone who travels widely and energetically; Someone who cleanses by scouring.,wndefs11.aiml
0,WNDEF SULFAMETHAZINE,*,*,A sulfa drug used like sulfadiazine and also in veterinary medicine.,wndefs11.aiml
0,WNDEF FARANDOLE,*,*,A lively dance from Provence; all the dancers join hands and execute various figures.,wndefs11.aiml
0,WNDEF VICTOR EMANUEL II,*,*,King of Italy who completed the unification of Italy by acquiring Venice and Rome (1820-1878).,wndefs11.aiml
0,WNDEF UNABRIDGED DICTIONARY,*,*,A dictionary that has not been shortened by the omitting terms or definitions; a comprehensive dictionary.,wndefs11.aiml
0,WNDEF UNETHICALLY,*,*,In an unethical manner.,wndefs11.aiml
0,WNDEF CHRISTMAS BOX,*,*,A present given at Christmas for services during the year.,wndefs11.aiml
0,WNDEF SYNDICALISM,*,*,A radical political movement that advocates bringing industry and government under the control of labor unions.,wndefs11.aiml
0,WNDEF TREMELLA,*,*,Fungi with yellowish gelatinous sporophores having convolutions resembling those of the brain.,wndefs11.aiml
0,WNDEF HAMAMELID DICOT FAMILY,*,*,Family of mostly woody dicotyledonous flowering plants with flowers often unisexual and often borne in catkins.,wndefs11.aiml
0,WNDEF WHIPPING,*,*,Beating with a whip or strap or rope as a form of punishment.,wndefs11.aiml
0,WNDEF HAIRDO,*,*,The arrangement of the hair (especially a woman's hair).,wndefs11.aiml
0,WNDEF LIGHT TIME,*,*,Distance measured in terms of the speed of light (or radio waves).,wndefs11.aiml
0,WNDEF TEA BREAD,*,*,Sweetened buns to be eaten with tea.,wndefs11.aiml
0,WNDEF KENNESAW MOUNTAIN,*,*,Battle of the American Civil War (1864); Union forces under William Tecumseh Sherman were repulsed by Confederate troops under Joseph Eggleston Johnston.,wndefs11.aiml
0,WNDEF SITZ BATH,*,*,A bathtub in which your buttocks and hips are immersed as if you were sitting in a chair and you bathe in a sitting position.,wndefs11.aiml
0,WNDEF FENCE LIZARD,*,*,Spiny lizard often seen basking on fences in the United States and northern Mexico.,wndefs11.aiml
0,WNDEF FATBACK,*,*,Salt pork from the back of a hog carcass.,wndefs11.aiml
0,WNDEF BEGUILING,*,*,Misleading by means of pleasant or alluring methods.,wndefs11.aiml
0,WNDEF DOUBLE STOPPING,*,*,Stopping two strings and producing two notes at the same time.,wndefs11.aiml
0,WNDEF LATENT DIABETES,*,*,A mild form of diabetes mellitus in which there are no overt symptoms but there are abnormal responses to some diagnostic procedures.,wndefs11.aiml
0,WNDEF AUTHORITARIAN,*,*,A person who behaves in an tyrannical manner; Expecting unquestioning obedience; Likened something to a dictator in severity; Characteristic of an absolute ruler or absolute rule; having absolute sovereignty.,wndefs11.aiml
0,WNDEF APONEUROTIC,*,*,Of or relating to an aponeurosis.,wndefs11.aiml
0,WNDEF EQUATABILITY,*,*,Capability of being equated.,wndefs11.aiml
0,WNDEF SIMEON,*,*,The 2nd son of Jacob and one of the 12 patriarchs of Israel.,wndefs11.aiml
0,WNDEF FERTILE PERIOD,*,*,The time in the menstrual cycle when fertilization is most likely to be possible (7 days before to 7 days after ovulation).,wndefs11.aiml
0,WNDEF ANTIPHON,*,*,A verse or song to be chanted or sung in response.,wndefs11.aiml
0,WNDEF CONVOLUTE,*,*,Rolled longitudinally upon itself; Rolled or coiled together.,wndefs11.aiml
0,WNDEF ONE-HUMPED,*,*,Having one hump.,wndefs11.aiml
0,WNDEF AERODYNAMIC FORCE,*,*,Forces acting on airfoils in motion relative to the air (or other gaseous fluids).,wndefs11.aiml
0,WNDEF KEELBOAT,*,*,River boat with a shallow draught and a keel but no sails; used to carry freight; moved by rowing or punting or towing.,wndefs11.aiml
0,WNDEF BOOT-SHAPED,*,*,Shaped like a boot.,wndefs11.aiml
0,WNDEF NITROGLYCERIN,*,*,A heavy yellow poisonous oily explosive liquid obtained by nitrating glycerol; used in making explosives and medically as a vasodilator (trade names Nitrospan and Nitrostat).,wndefs11.aiml
0,WNDEF KNIGHT BACHELOR,*,*,A knight of the lowest order; could display only a pennon.,wndefs11.aiml
0,WNDEF BITTERLY,*,*,In a resentful manner; Indicating something hard to accept.,wndefs11.aiml
0,WNDEF VASOPRESSOR,*,*,Any agent that produces vasoconstriction and a rise in blood pressure (usually understood as increased arterial pressure).,wndefs11.aiml
0,WNDEF LAYING,*,*,The production of eggs (especially in birds).,wndefs11.aiml
0,WNDEF THIN-SHELLED MUSSEL,*,*,Mussel with thin fragile shells having only rudimentary hinge teeth.,wndefs11.aiml
0,WNDEF FOREWARNING,*,*,An early warning about a future event.,wndefs11.aiml
0,WNDEF SHACKLE,*,*,A restraint that confines or restricts freedom (especially something used to tie down or restrain a prisoner); A U-shaped bar; the open end can be passed through chain links and closed with a bar.,wndefs11.aiml
0,WNDEF CLOSED-DOOR,*,*,Not open to the public.,wndefs11.aiml
0,WNDEF HAMADRYAD,*,*,The nymph or spirit of a particular tree; Large cobra of southeastern Asia and the East Indies; the largest venomous snake; sometimes placed in genus Naja.,wndefs11.aiml
0,WNDEF PARKING,*,*,The act of maneuvering a vehicle into a location where it can be left temporarily; Space in which vehicles can be parked.,wndefs11.aiml
0,WNDEF AETHER,*,*,Personification of the sky or upper air breathed by the Olympians; son of Erebus and night or of Chaos and darkness.,wndefs11.aiml
0,WNDEF HYALURONIC ACID,*,*,A viscous mucopolysaccharide found in the connective tissue space and the synovial fluid of movable joints and the humors of the eye; a cementing and protective substance.,wndefs11.aiml
0,WNDEF ABERDARE,*,*,A mining town in southern Wales.,wndefs11.aiml
0,WNDEF BOSKOP MAN,*,*,Possible early Homo sapiens represented by a cranium found in the Transvaal; formerly considered a separate species.,wndefs11.aiml
0,WNDEF EPICUREAN,*,*,Furnishing gratification of the senses; Of Epicurus or epicureanism.,wndefs11.aiml
0,WNDEF DISAVOWAL,*,*,Denial of any connection with or knowledge of.,wndefs11.aiml
0,WNDEF SUMEROLOGY,*,*,The archeology of ancient Sumerians.,wndefs11.aiml
0,WNDEF TELLINGLY,*,*,In a telling manner.,wndefs11.aiml
0,WNDEF DELIVER,*,*,Save something from sins; Deliver (a speech#Comma oration#Comma or idea); Utter (an exclamation#Comma noise#Comma etc.); Bring to a destination#Comma make a delivery; Throw or hurl from the mound to the batter#Comma as in baseball; Carry out or perform.,wndefs11.aiml
0,WNDEF RAT RACE,*,*,An exhausting routine that leaves no time for relaxation.,wndefs11.aiml
0,WNDEF ROUGHTAIL STINGRAY,*,*,One of the largest stingrays; found from Cape Cod to Cape Hatteras.,wndefs11.aiml
0,WNDEF INDISCRETION,*,*,A petty misdeed; The trait of being injudicious.,wndefs11.aiml
0,WNDEF CALCULATINGLY,*,*,In a calculating manner.,wndefs11.aiml
0,WNDEF OSSICLE,*,*,A small bone; especially one in the middle ear.,wndefs11.aiml
0,WNDEF UNCERTAINLY,*,*,Showing lack of certainty.,wndefs11.aiml
0,WNDEF LUNAR MONTH,*,*,The period between successive new moons (29.531 days).,wndefs11.aiml
0,WNDEF TWILIGHT SLEEP,*,*,A state of general anesthesia in which the person retains a slight degree of consciousness; can be induced by injection of scopolamine or morphine.,wndefs11.aiml
0,WNDEF TRIPOLI,*,*,The capital and chief port and largest city of Libya; in northwestern Libya on the Mediterranean Sea; founded by the Phoenicians in the 7th century BC.,wndefs11.aiml
0,WNDEF EMOTION,*,*,Any strong feeling.,wndefs11.aiml
0,WNDEF INTERLEAF,*,*,A blank leaf inserted between the leaves of a book.,wndefs11.aiml
0,WNDEF EPITHELIAL CELL,*,*,One of the closely packed cells forming the epithelium.,wndefs11.aiml
0,WNDEF GIANT ARMADILLO,*,*,About three feet long exclusive of tail.,wndefs11.aiml
0,WNDEF ALL ALONG,*,*,All the time or over a period of time.,wndefs11.aiml
0,WNDEF BALANCE OF POWER,*,*,An equilibrium of power between nations.,wndefs11.aiml
0,WNDEF OBLIGATED,*,*,Caused by law or conscience to follow a certain course.,wndefs11.aiml
0,WNDEF MARINADE,*,*,Soak something in marinade.,wndefs11.aiml
0,WNDEF SUZERAIN,*,*,A state exercising a degree of dominion over a dependent state especially in its foreign affairs.,wndefs11.aiml
0,WNDEF INDOLENT,*,*,Of tumors e.g.; slow to heal or develop and usually painless.,wndefs11.aiml
0,WNDEF CONSTRAINT,*,*,The act of constraining; the threat or use of force to control the thoughts or behavior of others; The state of being physically constrained.,wndefs11.aiml
0,WNDEF BUREAU OF THE CENSUS,*,*,The bureau of the Commerce Department responsible for taking the census; provides demographic information and analyses about the population of the United States.,wndefs11.aiml
0,WNDEF SKEW ARCH,*,*,An arch whose jambs are not at right angles with the face.,wndefs11.aiml
0,WNDEF NASION,*,*,The craniometric point at the bridge of the nose where the frontal and nasal bones of the skull meet.,wndefs11.aiml
0,WNDEF FAHRENHEIT THERMOMETER,*,*,A thermometer calibrated in degrees Fahrenheit.,wndefs11.aiml
0,WNDEF PARTY TO THE ACTION,*,*,A party of people taking a role in legal proceedings.,wndefs11.aiml
0,WNDEF ALGORITHM,*,*,A precise rule (or set of rules) specifying how to solve some problem.,wndefs11.aiml
0,WNDEF KOS,*,*,An Indian unit of length having different values in different localities.,wndefs11.aiml
0,WNDEF INSISTENT,*,*,Persistently continual.,wndefs11.aiml
0,WNDEF VERBALIZATION,*,*,Expressing something in words.,wndefs11.aiml
0,WNDEF NEIGHBORING,*,*,Situated near one another.,wndefs11.aiml
0,WNDEF FILTRATION,*,*,The act of changing a fluid by passing it through a filter; The process whereby fluids pass through a filter or a filtering medium.,wndefs11.aiml
0,WNDEF CLINICAL,*,*,Relating to a clinic or conducted in or as if in a clinic and depending on direct observation of patients; Scientifically detached; unemotional.,wndefs11.aiml
0,WNDEF CHILBLAIN,*,*,Inflammation of the hands and feet caused by exposure to cold and moisture.,wndefs11.aiml
0,WNDEF SQUAMULOSE,*,*,Covered with tiny scales.,wndefs11.aiml
0,WNDEF DECOROUSLY,*,*,In a proper and decorous manner.,wndefs11.aiml
0,WNDEF VASOPRESSIN,*,*,Hormone secreted by the posterior pituitary gland (trade name Pitressin) and also by nerve endings in the hypothalamus; affects blood pressure by stimulating capillary muscles and reduces urine flow by affecting reabsorption of water by kidney tubules.,wndefs11.aiml
0,WNDEF USUAL,*,*,Occurring or encountered or experienced or observed frequently or in accordance with regular practice or procedure.,wndefs11.aiml
0,WNDEF STIGMA,*,*,A skin lesion that is a diagnostic sign of some disease; An external tracheal aperture in a terrestrial arthropod.,wndefs11.aiml
0,WNDEF MYRINGOTOMY,*,*,Surgical incision into the eardrum (to relieve pressure or release pus from the middle ear).,wndefs11.aiml
0,WNDEF INTERVENOR,*,*,A party who interposes in a pending proceeding.,wndefs11.aiml
0,WNDEF YELLOW ADDER'S TONGUE,*,*,Eastern North American dogtooth having solitary yellow flowers marked with brown or purple and spotted interiors.,wndefs11.aiml
0,WNDEF CONSTRAINEDLY,*,*,In a constrained manner.,wndefs11.aiml
0,WNDEF RED GROUSE,*,*,Reddish-brown grouse of upland moors of Great Britain.,wndefs11.aiml
0,WNDEF LEXICOSTATISTIC,*,*,Pertaining to statistical methods used in studying the relations between languages.,wndefs11.aiml
0,WNDEF SINGULAR MATRIX,*,*,A square matrix whose determinant is zero.,wndefs11.aiml
0,WNDEF GAMBIAN MONETARY UNIT,*,*,Monetary unit in Gambia.,wndefs11.aiml
0,WNDEF WHIRLAWAY,*,*,Thoroughbred that won the triple crown in 1941.,wndefs11.aiml
0,WNDEF WIRE GLASS,*,*,A glass that contains a layer of wire netting in it.,wndefs11.aiml
0,WNDEF ORATORICAL,*,*,Characteristic of an orator or oratory.,wndefs11.aiml
0,WNDEF NONINTELLECTUAL,*,*,Not intellectual.,wndefs11.aiml
0,WNDEF SUSPENSION BRIDGE,*,*,A bridge that has a roadway supported by cables that are anchored at both ends.,wndefs11.aiml
0,WNDEF CORE BIT,*,*,An annular drilling bit to allow core samples to be taken.,wndefs11.aiml
0,WNDEF OCCULT,*,*,Occult practices and techniques; Hide from view; Become concealed or hidden from view or have its light extinguished; Hidden and difficult to see.,wndefs11.aiml
0,WNDEF GENICULAR VEIN,*,*,Veins that drain blood from structures around the knee; empty into the popliteal vein.,wndefs11.aiml
0,WNDEF WOOD MOUSE,*,*,Any of various New World woodland mice.,wndefs11.aiml
0,WNDEF PARAZOA,*,*,Multicellular organisms having less-specialized cells than in the Metazoa; comprises the single phylum Porifera.,wndefs11.aiml
0,WNDEF LABYRINTHINE,*,*,Resembling a labyrinth in form or complexity; Relating to or affecting or originating in the inner ear.,wndefs11.aiml
0,WNDEF BROAD-MINDED,*,*,Inclined to respect views and beliefs that differ from your own.,wndefs11.aiml
0,WNDEF STEAMED PUDDING,*,*,A pudding cooked by steaming.,wndefs11.aiml
0,WNDEF THIOTEPA,*,*,An antineoplastic drug used to treat certain malignancies.,wndefs11.aiml
0,WNDEF SCIENTIFIC KNOWLEDGE,*,*,Knowledge accumulated by systematic study and organized by general principles.,wndefs11.aiml
0,WNDEF ATLANTA,*,*,State capital and largest city of Georgia; chief commercial center of the southeastern United States; was plundered and burned by Sherman's army during the American Civil War; Federal troops under Sherman cut off the railroads supplying Atlanta and burned the city; 1864.,wndefs11.aiml
0,WNDEF INFOMERCIAL,*,*,A television commercial presented in the form of a short documentary.,wndefs11.aiml
0,WNDEF IRISH STEW,*,*,Meat (especially mutton) stewed with potatoes and onions.,wndefs11.aiml
0,WNDEF INSTRUCT,*,*,Give instructions or directions for some task.,wndefs11.aiml
0,WNDEF MYSTICALLY,*,*,In a mystical manner.,wndefs11.aiml
0,WNDEF DIAGONAL,*,*,An oblique line of squares of the same color on a checkerboard; A set of entries in a square matrix running diagonally either from the upper left to lower right entry or running from the upper right to lower left entry; A line or cut across a fabric that is not at right angles to a side of the fabric; A straight line connecting any two vertices of a polygon that are not adjacent; At an angle; especially connecting two nonadjacent corners of a plane figure or any two corners of a solid that are not in the same face.,wndefs11.aiml
0,WNDEF CEREBELLAR VEIN,*,*,The veins draining the cerebellum.,wndefs11.aiml
0,WNDEF PHOSPHORIC ACID,*,*,An acid used in fertilizers and soaps.,wndefs11.aiml
0,WNDEF APPROPRIATE,*,*,Suitable for a particular person or place or condition etc; Take possession of by force#Comma as after an invasion.,wndefs11.aiml
0,WNDEF OFFERING,*,*,Money contributed to a religious organization.,wndefs11.aiml
0,WNDEF LEFT BANK,*,*,The region of Paris on the southern bank of the Seine; a center of artistic and student life.,wndefs11.aiml
0,WNDEF LEAGUE,*,*,An association of sports teams that organizes matches for its members; An association of states or organizations or individuals for common action; An obsolete unit of distance of variable length (usually 3 miles); Unite to form a league.,wndefs11.aiml
0,WNDEF KOB,*,*,An orange-brown antelope of southeast Africa.,wndefs11.aiml
0,WNDEF LABIATAE,*,*,The mints.,wndefs11.aiml
0,WNDEF PUSEY,*,*,English theologian who (with John Henry Newman and John Keble) founded the Oxford movement (1800-1882).,wndefs11.aiml
0,WNDEF BICYCLE CHAIN,*,*,A chain that transmits the power from the pedals to the rear wheel of a bicycle.,wndefs11.aiml
0,WNDEF ENCYCLOPEDIA,*,*,A reference work (often in several volumes) containing articles on various topics (often arranged in alphabetical order) dealing with the entire range of human knowledge or with some particular specialty.,wndefs11.aiml
0,WNDEF ENCYCLOPEDIC,*,*,Broad in scope or content.,wndefs11.aiml
0,WNDEF HOUSE OF BURGESSES,*,*,The lower house of legislature in colonial Virginia.,wndefs11.aiml
0,WNDEF LARYNGITIS,*,*,Inflammation of the mucous membrane of the larynx; characterized by hoarseness or loss of voice and coughing.,wndefs11.aiml
0,WNDEF POLYPLACOPHORA,*,*,Small class of marine mollusks comprising the chitons; sometimes considered an order of the subclass Amphineura.,wndefs11.aiml
0,WNDEF COPTIC CHURCH,*,*,The ancient Christian church of Egypt.,wndefs11.aiml
0,WNDEF OLD WORLD ORIOLE,*,*,Mostly tropical songbird; the male is usually bright orange and black.,wndefs11.aiml
0,WNDEF PRIGGISHNESS,*,*,Exaggerated and arrogant properness.,wndefs11.aiml
0,WNDEF EQUIVALENT,*,*,The atomic weight of an element that has the same combining capacity as a given weight of another element; the standard is 8 for oxygen; A person or thing equal to another in value or measure or force or effect or significance etc.,wndefs11.aiml
0,WNDEF HISTIOCYTE,*,*,A macrophage that is found in connective tissue.,wndefs11.aiml
0,WNDEF ILEOCOLIC ARTERY,*,*,An artery that originates from the superior mesenteric artery and supplies the terminal part of the ileum and the cecum and the vermiform appendix and the ascending colon.,wndefs11.aiml
0,WNDEF EPKWELE,*,*,The basic unit of money in Equatorial Guinea.,wndefs11.aiml
0,WNDEF SWEPT,*,*,Possessing sweep.,wndefs11.aiml
