0,WNDEF *,*,*,unknown,wndefs0.aiml
0,WNDEF CAPITAL OFFENSE,*,*,A crime so serious that capital punishment is considered appropriate.,wndefs0.aiml
0,WNDEF RUBBISHY,*,*,Cheap and inferior; of no value.,wndefs0.aiml
0,WNDEF DESK OFFICER,*,*,A military officer who is not assigned to active duty.,wndefs0.aiml
0,WNDEF CLEFT PALATE,*,*,A congenital fissure of the hard palate.,wndefs0.aiml
0,WNDEF NECROMANCER,*,*,One who practices divination by conjuring up the dead.,wndefs0.aiml
0,WNDEF LOOKOUT,*,*,A structure commanding a wide view of its surroundings; The act of looking out; A person employed to watch for something to happen.,wndefs0.aiml
0,WNDEF FLY ROD,*,*,A long flexible fishing rod used in fly fishing.,wndefs0.aiml
0,WNDEF ONYMOUS,*,*,Bearing a name.,wndefs0.aiml
0,WNDEF ABHOR,*,*,Find repugnant.,wndefs0.aiml
0,WNDEF HALFTONE,*,*,A print obtained from photoengraving; An engraving used to reproduce an illustration.,wndefs0.aiml
0,WNDEF MERETRICIOUS,*,*,Like or relating to a prostitute.,wndefs0.aiml
0,WNDEF EXTINGUISH,*,*,Terminate or take out.,wndefs0.aiml
0,WNDEF BUMPKINLY,*,*,Awkwardly simple and provincial.,wndefs0.aiml
0,WNDEF NICKEL SILVER,*,*,A silver-white alloy containing copper and zinc and nickel.,wndefs0.aiml
0,WNDEF HELEN,*,*,The beautiful daughter of Zeus and Leda who was abducted by Paris; the Greek army sailed to Troy to get her back which resulted in the Trojan War.,wndefs0.aiml
0,WNDEF CRUD,*,*,An ill-defined bodily ailment; Heavy wet snow that is unsuitable for skiing.,wndefs0.aiml
0,WNDEF ALLERGIC RHINITIS,*,*,Rhinitis caused by an allergic reaction.,wndefs0.aiml
0,WNDEF UNSEASONABLENESS,*,*,Being at an inappropriate time.,wndefs0.aiml
0,WNDEF EDIFYING,*,*,Enlightening or uplifting so as to encourage intellectual or moral improvement.,wndefs0.aiml
0,WNDEF STOCK TRADER,*,*,Someone who buys and sells stock shares.,wndefs0.aiml
0,WNDEF OLD WORLD QUAIL,*,*,Small game bird with a rounded body and small tail.,wndefs0.aiml
0,WNDEF GLOBICEPHALA,*,*,Pilot whales.,wndefs0.aiml
0,WNDEF REDEEMER,*,*,Someone who redeems or buys back (promissory notes or merchandise or commercial paper etc.).,wndefs0.aiml
0,WNDEF CAST-IRON,*,*,Extremely robust.,wndefs0.aiml
0,WNDEF CRYONICS,*,*,The freezing of a seriously ill or recently deceased person to stop tissues from decomposing; the body is preserved until new medical cures are developed that might bring the person back to life.,wndefs0.aiml
0,WNDEF WHEEDLER,*,*,Someone who tries to persuade by blandishment and coaxing.,wndefs0.aiml
0,WNDEF BANK-DEPOSITOR RELATION,*,*,The.,wndefs0.aiml
0,WNDEF CRUS,*,*,The leg from the knee to foot.,wndefs0.aiml
0,WNDEF ASSEMBLYMAN,*,*,Someone who is a member of a legislative assembly.,wndefs0.aiml
0,WNDEF QUALITATIVE,*,*,Involving distinctions based on qualities; Relating to or involving comparisons based on qualities.,wndefs0.aiml
0,WNDEF ATHERINOPSIS,*,*,A genus of Atherinidae.,wndefs0.aiml
0,WNDEF UNBOUND,*,*,Not restrained or tied down by bonds; Not secured within a cover.,wndefs0.aiml
0,WNDEF CRUX,*,*,The most important point.,wndefs0.aiml
0,WNDEF GUATEMALAN MONETARY UNIT,*,*,Monetary unit in Guatemala.,wndefs0.aiml
0,WNDEF ENGAGE,*,*,Hire something for work or assistance; Get caught; Keep engaged; Carry on (wars#Comma battles#Comma or campaigns); Ask to represent; of legal counsel.,wndefs0.aiml
0,WNDEF LAMPOON ARTIST,*,*,A cartoonist who draws parodies or satirical renditions of cultural or social or political situations.,wndefs0.aiml
0,WNDEF CROONING,*,*,Singing in a soft low tone; The act of singing popular songs in a sentimental manner.,wndefs0.aiml
0,WNDEF INJUDICIOUS,*,*,Lacking or showing lack of judgment or discretion; unwise.,wndefs0.aiml
0,WNDEF BAPTISMAL FONT,*,*,Bowl for baptismal water.,wndefs0.aiml
0,WNDEF DISCONNECTED,*,*,Not plugged in or connected to a power source; Having been divided; having the unity destroyed.,wndefs0.aiml
0,WNDEF VICARIOUSLY,*,*,Indirectly#Comma as#Comma by#Comma or through a substitute.,wndefs0.aiml
0,WNDEF ALL-VICTORIOUS,*,*,Never having lost.,wndefs0.aiml
0,WNDEF ADENOMATOUS POLYP,*,*,A polyp that consists of benign neoplastic tissue derived from glandular epithelium.,wndefs0.aiml
0,WNDEF RUSSIAN OLIVE,*,*,Deciduous shrubby tree of Europe and western Asia having gray leaves and small yellow fruits covered in silvery scales; sometimes spiny.,wndefs0.aiml
0,WNDEF SKIFFLE GROUP,*,*,A band of musicians who play skiffle.,wndefs0.aiml
0,WNDEF EVENLY,*,*,In a level and regular way; In equal amounts or shares; in a balanced or impartial way.,wndefs0.aiml
0,WNDEF MATTRESS PAD,*,*,A protective pad over a mattress to protect it.,wndefs0.aiml
0,WNDEF FROWN,*,*,A facial expression of dislike or displeasure; Look angry or sullen#Comma wrinkle one's forehead#Comma as if to signal disapproval.,wndefs0.aiml
0,WNDEF SOKORO,*,*,A Chadic language spoken in Chad.,wndefs0.aiml
0,WNDEF OSTENTATIOUS,*,*,Of a display that is tawdry or vulgar; Intended to attract notice and impress others.,wndefs0.aiml
0,WNDEF TRIBROMOETHANOL,*,*,An intravenous anesthetic.,wndefs0.aiml
0,WNDEF FOOTER,*,*,The height or length of something in feet.,wndefs0.aiml
0,WNDEF SUBVENTION,*,*,The act or process of providing aid or help of any sort.,wndefs0.aiml
0,WNDEF MORONITY,*,*,Mild mental retardation.,wndefs0.aiml
0,WNDEF RIBBON SNAKE,*,*,Slender yellow-striped North American garter snake; prefers wet places.,wndefs0.aiml
0,WNDEF ACANTHOSCELIDES,*,*,A genus of Bruchidae.,wndefs0.aiml
0,WNDEF ESTIVATION,*,*,The arrangement of sepals and petals in a flower bud before it opens; Cessation or slowing of activity during the summer; especially slowing of metabolism in some animals during a hot or dry period.,wndefs0.aiml
0,WNDEF PUSHER,*,*,A sandal attached to the foot by a thong over the toes; Someone who pushes; An unlicensed dealer in illegal drugs; One who intrudes or pushes himself forward.,wndefs0.aiml
0,WNDEF TIMOR,*,*,An island in Indonesia in the Malay Archipelago; the largest and most eastern of the Lesser Sunda Islands.,wndefs0.aiml
0,WNDEF ANDREAEALES,*,*,Comprises a single genus.,wndefs0.aiml
0,WNDEF BILGE KEEL,*,*,Either of two lengthwise fins attached along the outside of a ship's bilge; reduces rolling.,wndefs0.aiml
0,WNDEF DETERMINATION,*,*,The act of determining the properties of something; The quality of being determined to do or achieve something.,wndefs0.aiml
0,WNDEF LAMBREQUIN,*,*,Short and decorative hanging for a shelf edge or top of a window casing; A scarf that covers a knight's helmet.,wndefs0.aiml
0,WNDEF BULBIL,*,*,Small bulb or bulb-shaped growth arising from the leaf axil or in the place of flowers.,wndefs0.aiml
0,WNDEF FJORD,*,*,A long narrow inlet of the sea between steep cliffs; common in Norway.,wndefs0.aiml
0,WNDEF MORCHELLA,*,*,Genus of edible fungi.,wndefs0.aiml
0,WNDEF FARCICAL,*,*,Broadly or extravagantly humorous; resembling farce.,wndefs0.aiml
0,WNDEF PILL BUG,*,*,Small terrestrial isopod with a convex segmented body that can roll up into a ball.,wndefs0.aiml
0,WNDEF GAY LIBERATION MOVEMENT,*,*,The movement aimed at liberating homosexuals from legal or social or economic oppression.,wndefs0.aiml
0,WNDEF SKELETON KEY,*,*,A passkey with much of the bit filed away so that it can open different locks.,wndefs0.aiml
0,WNDEF PYRAUSTA,*,*,Moths whose larvae are corn borers.,wndefs0.aiml
0,WNDEF NOSEBLEED,*,*,Bleeding from the nose.,wndefs0.aiml
0,WNDEF LOOP-LINE,*,*,A railway branch line that branches from the trunk line and then rejoins it later on.,wndefs0.aiml
0,WNDEF MONOSEMY,*,*,Having a single meaning (absence of ambiguity) usually of individual words or phrases.,wndefs0.aiml
0,WNDEF ETHNIC CLEANSING,*,*,The mass expulsion and killing of one ethic or religious group in an area by another ethnic or religious group in that area.,wndefs0.aiml
0,WNDEF BERGMAN,*,*,Swedish film actress (1915-1982); Swedish film director who used heavy symbolism and explored the psychology of the characters (born 1918).,wndefs0.aiml
0,WNDEF SLIVER,*,*,Form into slivers; Divide into slivers or splinters.,wndefs0.aiml
0,WNDEF REVITALIZED,*,*,Restored to new life and vigor.,wndefs0.aiml
0,WNDEF STOICISM,*,*,An indifference to pleasure or pain; The philosophical system of the Stoics following the teachings of the ancient Greek philosopher Zeno.,wndefs0.aiml
0,WNDEF MILLIONAIRE,*,*,A person whose material wealth is valued at more than a million dollars.,wndefs0.aiml
0,WNDEF DITHERING,*,*,The process of representing intermediate colors by patterns of tiny colored dots that simulate the desired color.,wndefs0.aiml
0,WNDEF NECTAR,*,*,A sweet liquid secretion that is attractive to pollinators; Fruit juice especially when undiluted.,wndefs0.aiml
0,WNDEF PRURITUS,*,*,An intense itching sensation that can have various causes (as by allergies or infection or lymphoma or jaundice etc.).,wndefs0.aiml
0,WNDEF BUSINESSWOMAN,*,*,A female businessperson.,wndefs0.aiml
0,WNDEF SANDAL,*,*,A shoe consisting of a sole fastened by straps to the foot.,wndefs0.aiml
0,WNDEF LOUIS IX,*,*,King of France and son of Louis VIII; he led two unsuccessful crusades; considered an ideal medieval king (1214-1270).,wndefs0.aiml
0,WNDEF LOUIS IV,*,*,King of France (921-954).,wndefs0.aiml
0,WNDEF DISBELIEVING,*,*,Denying or questioning the tenets of especially a religion.,wndefs0.aiml
0,WNDEF REVIEWING STAND,*,*,A stand from which a parade or military force can be reviewed.,wndefs0.aiml
0,WNDEF WATERWORKS,*,*,Workplace where water is stored and purified and distributed for a community.,wndefs0.aiml
0,WNDEF XENOTRANSPLANT,*,*,A surgical procedure in which tissue or whole organs are transfered from one species to another species.,wndefs0.aiml
0,WNDEF FELT FERN,*,*,East Asian fern having fronds shaped like tongues; sometimes placed in genus Cyclophorus.,wndefs0.aiml
0,WNDEF LOUIS II,*,*,King of France and Germany (846-879).,wndefs0.aiml
0,WNDEF SEND DOWN,*,*,Suspend something temporarily from college or university#Comma in England.,wndefs0.aiml
0,WNDEF SIDE EFFECT,*,*,Any adverse and unwanted secondary effect; A secondary and usually adverse effect of a drug or therapy.,wndefs0.aiml
0,WNDEF BEARER,*,*,A messenger who bears or presents.,wndefs0.aiml
0,WNDEF ALGORITHMIC LANGUAGE,*,*,An artificial language designed to express algorithms.,wndefs0.aiml
0,WNDEF THUMBTACK,*,*,A tack for attaching papers to a bulletin board or drawing board; Fasten with thumbtacks.,wndefs0.aiml
0,WNDEF FAMISHED,*,*,Extremely hungry.,wndefs0.aiml
0,WNDEF SPIRITUALTY,*,*,Property or income owned by a church.,wndefs0.aiml
0,WNDEF PRIODONTES,*,*,Solely the giant armadillo.,wndefs0.aiml
0,WNDEF HOOKE'S LAW,*,*,The principle that (within the elastic limit) the stress applied to a solid is proportional to the strain produced.,wndefs0.aiml
0,WNDEF TEXAS TORTOISE,*,*,Close relative to the desert tortoise; may be reclassified as a member of genus Xerobates.,wndefs0.aiml
0,WNDEF CARDIAC MUSCLE,*,*,The muscle tissue of the heart; adapted to continued rhythmic contraction.,wndefs0.aiml
0,WNDEF BUS LANE,*,*,A traffic lane intended for buses only.,wndefs0.aiml
0,WNDEF ZU,*,*,Evil storm god represented as a black bird.,wndefs0.aiml
0,WNDEF PLAY READING,*,*,Performance of a play by a group of readers.,wndefs0.aiml
0,WNDEF KNEELER,*,*,A board (sometimes cushioned) for someone to kneel on; A person in a kneeling position.,wndefs0.aiml
0,WNDEF WOMANLIKE,*,*,Resembling a woman.,wndefs0.aiml
0,WNDEF BEER GARDEN,*,*,Tavern with an outdoor area (usually resembling a garden) where beer and other alcoholic drinks are served.,wndefs0.aiml
0,WNDEF MIDDLE AGE,*,*,The time of life between youth and old age (e.g.#Comma between 40 and 60 years of age).,wndefs0.aiml
0,WNDEF DIGRESSIVE,*,*,(of e.g. speech and writing) tending to depart from the main point or cover a wide range of subjects; Of superficial relevance if any.,wndefs0.aiml
0,WNDEF VENERIDAE,*,*,Hard-shell clams.,wndefs0.aiml
0,WNDEF STARFLOWER,*,*,Common Old World herb having grasslike leaves and clusters of star-shaped white flowers with green stripes; naturalized in the eastern United States.,wndefs0.aiml
0,WNDEF LEAD-ACID BATTERY,*,*,A battery with lead electrodes with dilute sulphuric acid as the electrolyte; each cell generates about 2 volts.,wndefs0.aiml
0,WNDEF OSSIFICATION,*,*,Hardened conventionality; The developmental process of bone formation; The calcification of soft tissue into a bonelike material; The process of becoming rigidly fixed in a conventional pattern of thought or behavior.,wndefs0.aiml
0,WNDEF THEORETICALLY,*,*,In a theoretical manner.,wndefs0.aiml
0,WNDEF CLEARWAY,*,*,A road on which you are not allowed to stop (unless you have a breakdown).,wndefs0.aiml
0,WNDEF RACIALLY,*,*,With respect to race.,wndefs0.aiml
0,WNDEF TRISOMY,*,*,Chrosomal abnormality in which there is one more than the normal number of chromosomes in a cell.,wndefs0.aiml
0,WNDEF VAULTER,*,*,An athlete who jumps over a high crossbar with the aid of a long pole.,wndefs0.aiml
0,WNDEF CYPRINID,*,*,Soft-finned mainly freshwater fishes typically having toothless jaws and cycloid scales; Of or relating to members of fish family Cyprinidae.,wndefs0.aiml
0,WNDEF LEATHERETTE,*,*,Fabric made to look like leather.,wndefs0.aiml
0,WNDEF HOOD LATCH,*,*,A catch that holds the hood of a car shut.,wndefs0.aiml
0,WNDEF POINT LACE,*,*,Lace worked with a needle in a buttonhole stitch on a paper pattern.,wndefs0.aiml
0,WNDEF XX,*,*,Normal complement of sex chromosomes in a female.,wndefs0.aiml
0,WNDEF XY,*,*,Normal complement of sex hormones in a male.,wndefs0.aiml
0,WNDEF GEORGE,*,*,Elector of Hanover and the first Hanoverian King of Great Britain and Ireland from 1714 to 1727 (1660-1727); King of Great Britain and Elector of Hanover from 1727 to 1760 (1683-1760); King of Great Britain and Ireland from 1760 to 1820; the American colonies were lost during his reign; he became insane in 1811 and his son (later George IV) acted as regent until 1820 (1738-1820); King of Great Britain and Ireland and Hanover from 1820 to 1830; his attempt to divorce his estranged wife undermined the prestige of the crown (1762-1830); King of Great Britain and Ireland and emperor of India from 1910 to 1936; gave up his German title in 1917 during World War I (1865-1936); King of Great Britain and Ireland and emperor of India from 1936 to 1947; he succeeded Edward VIII (1895-1952); Christian martyr; patron saint of England; hero of the legend of Saint George and the Dragon in which he slew a dragon and saved a princess (?-303).,wndefs0.aiml
0,WNDEF TODIDAE,*,*,A family of birds of the order Coraciiformes.,wndefs0.aiml
0,WNDEF HOOK SHOT,*,*,A basketball shot made over the head with the hand that is farther from the basket.,wndefs0.aiml
0,WNDEF CIVIL SERVICE,*,*,Government workers; usually hired on the basis of competitive examinations.,wndefs0.aiml
0,WNDEF IMPORT DUTY,*,*,A duty imposed on imports.,wndefs0.aiml
0,WNDEF MENACE,*,*,A threat or the act of threatening; Act in a threatening manner; Something that is a source of danger; Express a threat either by an utterance or a gesture.,wndefs0.aiml
0,WNDEF MISDIRECT,*,*,Put a wrong address on something.,wndefs0.aiml
0,WNDEF FRIULIAN,*,*,A Rhaeto-Romance dialect spoken in northeastern Italy.,wndefs0.aiml
0,WNDEF STUDDED,*,*,Dotted or adorned with or as with studs or nailheads.,wndefs0.aiml
0,WNDEF REAL PROPERTY,*,*,Property consisting of houses and land.,wndefs0.aiml
0,WNDEF CEREMONIOUSLY,*,*,In a ceremonious manner.,wndefs0.aiml
0,WNDEF NURTURANCE,*,*,Physical and emotional care and nourishment.,wndefs0.aiml
0,WNDEF PRESIDENT,*,*,The chief executive of a republic; An executive officer of a firm or corporation; The officer who presides at the meetings of an organization; The head administrative officer of a college or university.,wndefs0.aiml
0,WNDEF RURITANIAN,*,*,An imaginary inhabitant of Ruritania; Of or pertaining to or characteristic of Ruritania (or any other imaginary country).,wndefs0.aiml
0,WNDEF LOUIS XV,*,*,Grandson of Louis XIV and king of France from 1715 to 1774 who led France into the War of the Austrian Succession and the Seven Years' War (1710-1774).,wndefs0.aiml
0,WNDEF LOWER-CLASS,*,*,Occupying the lowest socioeconomic position in a society.,wndefs0.aiml
0,WNDEF SHATTER,*,*,Break into many pieces; Break something into many pieces.,wndefs0.aiml
0,WNDEF SMALLNESS,*,*,The property of having relatively little strength or vigor; The property of having a relatively small size; The property of being a relatively small amount.,wndefs0.aiml
0,WNDEF HIMMLER,*,*,German Nazi who was chief of the SS and the Gestapo and who oversaw the genocide of six million Jews (1900-1945).,wndefs0.aiml
0,WNDEF SCHICK TEST,*,*,A skin test for immunity to diphtheria.,wndefs0.aiml
0,WNDEF URTICATION,*,*,A sensation of having been stung by nettles; An itchy skin eruption characterized by weals with pale interiors and well-defined red margins; usually the result of an allergic response to insect bites or food or drugs.,wndefs0.aiml
0,WNDEF FINELY,*,*,In a delicate manner; In an elegant manner; In tiny pieces.,wndefs0.aiml
0,WNDEF PREDATOR,*,*,Any animal that lives by preying on other animals.,wndefs0.aiml
0,WNDEF GLOTTAL,*,*,Of or relating to or produced by the glottis.,wndefs0.aiml
0,WNDEF ELECTRIC DIPOLE MOMENT,*,*,The dipole moment in an electric dipole.,wndefs0.aiml
0,WNDEF ANTHOLOGIZE,*,*,Compile an anthology.,wndefs0.aiml
0,WNDEF VIEQUES,*,*,A small island off the coast of Puerto Rico used for target practice by the United States Navy.,wndefs0.aiml
0,WNDEF CHICKEREE,*,*,Far western United States counterpart of the red squirrel.,wndefs0.aiml
0,WNDEF HYPEROPE,*,*,A person with hyperopia; a farsighted person.,wndefs0.aiml
0,WNDEF MITOSIS,*,*,Cell division in which the nucleus divides into nuclei containing the same number of chromosomes.,wndefs0.aiml
0,WNDEF SEALING WAX,*,*,Fastener consisting of a resinous composition that is plastic when warm; used for sealing documents and parcels and letters.,wndefs0.aiml
0,WNDEF NEXUS,*,*,A connected series or group.,wndefs0.aiml
0,WNDEF PATHOLOGICALLY,*,*,With respect to pathology.,wndefs0.aiml
0,WNDEF WEST SOUTHWEST,*,*,The compass point midway between west and southwest.,wndefs0.aiml
0,WNDEF INCULCATION,*,*,Teaching or impressing upon the mind by frequent instruction or repetition.,wndefs0.aiml
0,WNDEF NOVENA,*,*,A Roman Catholic devotion consisting of prayers on nine consecutive days.,wndefs0.aiml
0,WNDEF MACROZOARCES,*,*,A genus of Zoarcidae.,wndefs0.aiml
0,WNDEF HYDRANGEACEAE,*,*,Sometimes included in the family Saxifragaceae.,wndefs0.aiml
0,WNDEF RIOJA,*,*,Dry red table wine from the Rioja region of northern Spain.,wndefs0.aiml
0,WNDEF FLOODLIT,*,*,Illuminated something by means of floodlights.,wndefs0.aiml
0,WNDEF BREVOORTIA,*,*,Menhaden.,wndefs0.aiml
0,WNDEF ETERNAL LIFE,*,*,Life without beginning or end.,wndefs0.aiml
0,WNDEF LAKE CHAMPLAIN,*,*,A lake in northeastern New York#Comma northwestern Vermont and southern Quebec; site of many battles in the French and Indian War and in the American Revolution and in the War of 1812.,wndefs0.aiml
0,WNDEF AMPERE-MINUTE,*,*,A unit of charge equal to 60 coulombs.,wndefs0.aiml
0,WNDEF FARM GIRL,*,*,A girl who has grown up on a farm.,wndefs0.aiml
0,WNDEF DISINFECTION,*,*,Treatment to destroy harmful microorganisms.,wndefs0.aiml
0,WNDEF BLACK-SEEDED,*,*,Having black seeds.,wndefs0.aiml
0,WNDEF ELAND,*,*,Either of two large African antelopes of the genus Taurotragus having short spirally twisted horns in both sexes.,wndefs0.aiml
0,WNDEF SPHENISCUS,*,*,Type genus of the Spheniscidae.,wndefs0.aiml
0,WNDEF MURMUROUS,*,*,Characterized by soft sounds.,wndefs0.aiml
0,WNDEF SELF-SEALING,*,*,Seals something without the application of moisture; Capable of sealing itself as after being pierced.,wndefs0.aiml
0,WNDEF GLENN,*,*,Made the first orbital rocket-powered flight by a United States astronaut in 1962; later in United States Senate (1921-).,wndefs0.aiml
0,WNDEF UNDERCUT,*,*,A notch cut in the trunk of tree in order to determine the direction of its fall; Cut away the underpart of something; A cut made underneath to remove material; The material removed by a cut made underneath; Strike (the ball) in golf#Comma tennis#Comma or hockey obliquely downward so as to give a backspin or elevation to the shot; Cut away material from the underside of (an object) so as to leave an overhanging portion in relief.,wndefs0.aiml
0,WNDEF SPADE BIT,*,*,A thin bit with a center point and cutting edges on either side.,wndefs0.aiml
0,WNDEF BRITISHER,*,*,A native or inhabitant of Great Britain.,wndefs0.aiml
0,WNDEF HEADMISTRESS,*,*,A woman headmaster.,wndefs0.aiml
0,WNDEF KHRUSHCHEV,*,*,Soviet statesman and premier who denounced Stalin (1894-1971).,wndefs0.aiml
0,WNDEF JEWISH CALENDAR MONTH,*,*,A month in the Jewish calendar.,wndefs0.aiml
0,WNDEF AUTOFLUORESCENCE,*,*,Self-induced fluorescence.,wndefs0.aiml
0,WNDEF SUBLEASE,*,*,A lease from one lessee to another.,wndefs0.aiml
0,WNDEF EDIBLE SNAIL,*,*,One of the chief edible snails.,wndefs0.aiml
0,WNDEF SUMMER-FLOWERING,*,*,Of plants that bloom during the summer.,wndefs0.aiml
0,WNDEF BLACK SPRUCE,*,*,Small spruce of boggy areas of northeastern North America having spreading branches with dense foliage; inferior wood.,wndefs0.aiml
0,WNDEF WISH LIST,*,*,A list of events that you wish would occur.,wndefs0.aiml
0,WNDEF MINARET,*,*,Slender tower with balconies.,wndefs0.aiml
0,WNDEF TARSIUS GLIS,*,*,A variety of tarsier.,wndefs0.aiml
0,WNDEF FURCATION,*,*,The place where something divides into branches.,wndefs0.aiml
0,WNDEF LAID LOW,*,*,Put out of action (by illness).,wndefs0.aiml
0,WNDEF CHECKPOINT,*,*,A place (as at a frontier) where travellers are stopped for inspection and clearance.,wndefs0.aiml
0,WNDEF PITYMYS,*,*,Pine mice.,wndefs0.aiml
0,WNDEF SURTAX,*,*,Levy an extra tax on something; An additional tax on certain kinds of income that has already been taxed.,wndefs0.aiml
0,WNDEF CERATOPSIA,*,*,Horned dinosaurs.,wndefs0.aiml
0,WNDEF HOLOCAUST,*,*,An act of great destruction and loss of life; The Nazi program of exterminating Jews under Hitler.,wndefs0.aiml
0,WNDEF MASS DEFECT,*,*,The amount by which the mass of an atomic nucleus is less than the sum of the masses of its constituent particles.,wndefs0.aiml
0,WNDEF WHEAT FUTURE,*,*,Wheat bought or sold at an agreed price for delivery at a specified future date.,wndefs0.aiml
0,WNDEF BLACK KNOT,*,*,Disease of plum and cherry trees characterized by black excrescences on the branches.,wndefs0.aiml
0,WNDEF DARIUS I,*,*,King of Persia who expanded the empire and invaded Greece but was defeated at the battle of Marathon (550-486 BC).,wndefs0.aiml
0,WNDEF VICTORY LAP,*,*,A lap by the winning person or team run to celebrate the victory.,wndefs0.aiml
0,WNDEF MILES PER HOUR,*,*,A speedometer reading for the momentary rate of travel; The ratio of the distance traveled (in miles) to the time spent traveling (in hours).,wndefs0.aiml
0,WNDEF ARAMUS,*,*,Genus of large brown long-billed wading birds found in warm swampy regions of the western hemisphere.,wndefs0.aiml
0,WNDEF GENERAL LEDGER,*,*,The ledger that contains all of the financial accounts of a business; contains offsetting debit and credit accounts (including control accounts).,wndefs0.aiml
0,WNDEF OUTDOORSMAN,*,*,A person who spends time outdoors (e.g.#Comma hunting or fishing).,wndefs0.aiml
0,WNDEF DESCRIPTIVISM,*,*,A doctrine supporting or promoting descriptive linguistics; A doctrine holding that moral statements have a truth value.,wndefs0.aiml
0,WNDEF CESTIDA,*,*,Ctenophore having short tentacles; one family.,wndefs0.aiml
0,WNDEF GARNER,*,*,Store grain.,wndefs0.aiml
0,WNDEF LIEPAJA,*,*,A city of southwestern Latvia on the Baltic Sea.,wndefs0.aiml
0,WNDEF WALKABOUT,*,*,Nomadic excursions into the bush made by an Aborigine; A public stroll by a celebrity to meet people informally; A walking trip or tour.,wndefs0.aiml
0,WNDEF CALIFORNIA SINGLE-LEAF PINYON,*,*,Very small tree similar to Rocky mountain pinon but having a single needle per fascicle; similar to Parry's pinyon in range.,wndefs0.aiml
0,WNDEF OBSTREPEROUSLY,*,*,In manner that attracts attention.,wndefs0.aiml
0,WNDEF NOBLESSE OBLIGE,*,*,The obligation of those of high rank to be honorable and generous.,wndefs0.aiml
0,WNDEF SPAMMER,*,*,Someone who sends unwanted email (often in bulk).,wndefs0.aiml
0,WNDEF FIRST EPISTLE OF JOHN,*,*,The first New Testament epistle traditionally attributed to Saint John the Apostle.,wndefs0.aiml
0,WNDEF CARPENTER'S HAMMER,*,*,A hammer with a cleft at one end for pulling nails.,wndefs0.aiml
0,WNDEF VERNAL EQUINOX,*,*,The equinoctial point that lies in the constellation of Pisces; March 21.,wndefs0.aiml
0,WNDEF INUNDATE,*,*,Fill or cover completely#Comma usually with water.,wndefs0.aiml
0,WNDEF PULVERIZATION,*,*,Annihilation by pulverizing something.,wndefs0.aiml
0,WNDEF MELAMINE RESIN,*,*,A thermosetting resin formed from melamine and an aldehyde; used in molded products#Comma adhesives#Comma and coatings.,wndefs0.aiml
0,WNDEF CORRELATIONAL,*,*,Relating to or employing correlation.,wndefs0.aiml
0,WNDEF TODDLER,*,*,A young child.,wndefs0.aiml
0,WNDEF RACKING,*,*,Causing great physical or mental suffering.,wndefs0.aiml
0,WNDEF SPIZELLA,*,*,Chipping sparrow; field sparrow; tree sparrow.,wndefs0.aiml
0,WNDEF CHUTZPA,*,*,Unbelievable gall; insolence; audacity.,wndefs0.aiml
0,WNDEF NEGOTIATOR,*,*,Someone who negotiates (confers with others in order to reach a settlement).,wndefs0.aiml
0,WNDEF INDECENTLY,*,*,In an indecent manner.,wndefs0.aiml
0,WNDEF BRACHYURA,*,*,An order of crustaceans (including true crabs) having a reduced abdomen folded against the ventral surface.,wndefs0.aiml
0,WNDEF DISMISSIVE,*,*,Showing indifference or disregard.,wndefs0.aiml
0,WNDEF PURANIC,*,*,Of or relating to the Purana.,wndefs0.aiml
0,WNDEF BIG SIOUX RIVER,*,*,A river that rises in northeastern South Dakota and flows southward to join the Missouri River at Sioux City#Comma Iowa.,wndefs0.aiml
