0,WNDEF *,*,*,unknown,wndefs0.aiml
0,WNDEF SPLURGE,*,*,Indulge oneself; An ostentatious display (of effort or extravagance etc.); Be showy or ostentatious.,wndefs0.aiml
0,WNDEF TEXT EDITOR,*,*,An application that can be used to create and view and edit text files.,wndefs0.aiml
0,WNDEF STRIPED BASS,*,*,Caught along the Atlantic coast of the United States; Marine food and game fish with dark longitudinal stripes; migrates upriver to spawn; sometimes placed in the genus Morone.,wndefs0.aiml
0,WNDEF TORRICELLI,*,*,Italian physicist who invented the mercury barometer (1608-1647).,wndefs0.aiml
0,WNDEF MARINA,*,*,A fancy dock for small yachts and cabin cruisers.,wndefs0.aiml
0,WNDEF ELECTRIC HAMMER,*,*,A hammer driven by electric motor.,wndefs0.aiml
0,WNDEF PORTACAVAL SHUNT,*,*,Shunt that is created surgically between the portal vein and the inferior vena cava so that blood from the abdominal organs can bypass the liver.,wndefs0.aiml
0,WNDEF ANISOGAMETIC,*,*,Relating to either of a pair of dissimilar (anisogamic) gametes combining in sexual reproduction.,wndefs0.aiml
0,WNDEF IMPLICATION,*,*,A logical relation between propositions p and q of the form if p then q; if p is true then q cannot be false; An accusation that brings into intimate and usually incriminating connection; A relation implicated by virtue of involvement or close connection (especially an incriminating involvement).,wndefs0.aiml
0,WNDEF EAGLE,*,*,An emblem representing power; Shoot in two strokes under par; A former gold coin in the United States worth 10 dollars; To shoot two strokes under par.,wndefs0.aiml
0,WNDEF SOCIAL STATION,*,*,Position in a social hierarchy.,wndefs0.aiml
0,WNDEF JAPANESE MONETARY UNIT,*,*,Monetary unit in Japan.,wndefs0.aiml
0,WNDEF BIRTHMARK,*,*,A blemish on the skin formed before birth.,wndefs0.aiml
0,WNDEF TINKLE,*,*,Make or emit a high sound.,wndefs0.aiml
0,WNDEF PROPERTY,*,*,A basic or essential attribute shared by all members of a class; Any movable articles or objects used on the set of a play or movie; A construct whereby objects or individuals can be distinguished; Something owned; any tangible or intangible possession that is owned by someone.,wndefs0.aiml
0,WNDEF GENUS JUNCO,*,*,American finches.,wndefs0.aiml
0,WNDEF COYPU,*,*,Aquatic South American rodent resembling a small beaver; bred for its fur.,wndefs0.aiml
0,WNDEF NABOB,*,*,A wealthy man (especially one who made his fortune in the Orient).,wndefs0.aiml
0,WNDEF PERORATE,*,*,Deliver an oration in grandiloquent style; Conclude a speech with a formal recapitulation.,wndefs0.aiml
0,WNDEF GRUYERE,*,*,Swiss cheese with small holes.,wndefs0.aiml
0,WNDEF TECHIE,*,*,A technician who is highly proficient and enthusiastic about some technical field (especially computing).,wndefs0.aiml
0,WNDEF ERMINE,*,*,Mustelid of northern hemisphere in its white winter coat.,wndefs0.aiml
0,WNDEF CHORAL ODE,*,*,Ode sung by the chorus in classical Greek drama.,wndefs0.aiml
0,WNDEF COMMON-LAW MARRIAGE,*,*,A marriage relationship created by agreement and cohabitation rather than by ceremony.,wndefs0.aiml
0,WNDEF WHITE MAN'S BURDEN,*,*,The.,wndefs0.aiml
0,WNDEF ELECTRONIC EQUIPMENT,*,*,Equipment that involves the controlled conduction of electrons (especially in a gas or vacuum or semiconductor).,wndefs0.aiml
0,WNDEF MORTIFICATION,*,*,The act of mortifying the lusts of the flesh by self-denial and privation (especially by bodily pain or discomfort inflicted on yourself).,wndefs0.aiml
0,WNDEF HALOGETON,*,*,A coarse annual herb introduced into North America from Siberia; dangerous to sheep and cattle on western rangelands because of its high oxalate content.,wndefs0.aiml
0,WNDEF BAWDILY,*,*,In a bawdy manner.,wndefs0.aiml
0,WNDEF EUGLENOPHYCEAE,*,*,Coextensive with the division Euglenophyta.,wndefs0.aiml
0,WNDEF PRETTY,*,*,Pleasing by delicacy or grace; not imposing.,wndefs0.aiml
0,WNDEF VIOLACEAE,*,*,A family of order Parietales including the genera Viola#Comma Hybanthus#Comma Hymenanthera#Comma Melicytus.,wndefs0.aiml
0,WNDEF PREPOSE,*,*,Place something before another constituent in the sentence.,wndefs0.aiml
0,WNDEF LIFEGUARD,*,*,An attendant employed at a beach or pool to protect swimmers from accidents.,wndefs0.aiml
0,WNDEF CITY STATE,*,*,A state consisting of a sovereign city.,wndefs0.aiml
0,WNDEF CRANK CALL,*,*,A hostile telephone call (from a crank).,wndefs0.aiml
0,WNDEF MALEATE,*,*,A salt or ester of maleic acid; used as a nontricyclic antidepressant drug for psychomotor activation.,wndefs0.aiml
0,WNDEF NASTURTIUM,*,*,Aquatic herbs.,wndefs0.aiml
0,WNDEF SWITCH-HITTER,*,*,Slang term for a bisexual person; A baseball player who can bat either right or left handed.,wndefs0.aiml
0,WNDEF HINDUSTANI,*,*,A form of Hindi spoken around Delhi; Of or relating to or characteristic of Hindustan or its people or language.,wndefs0.aiml
0,WNDEF COCKADE,*,*,An ornament (such as a knot of ribbon or a rosette) usually worn on the hat.,wndefs0.aiml
0,WNDEF EVEN-TOED UNGULATE,*,*,Placental mammal having hooves with an even number of functional toes on each foot.,wndefs0.aiml
0,WNDEF UNDERACT,*,*,Act (a role) with great restraint.,wndefs0.aiml
0,WNDEF HATCHWAY,*,*,An entrance equipped with a hatch; especially a passageway between decks of a ship.,wndefs0.aiml
0,WNDEF FOUNDRESS,*,*,A woman founder.,wndefs0.aiml
0,WNDEF CLASSICAL LATIN,*,*,The language of educated people in ancient Rome.,wndefs0.aiml
0,WNDEF FANCONI'S ANEMIA,*,*,A rare congenital anemia characterized by pancytopenia and hypoplasia of the bone marrow.,wndefs0.aiml
0,WNDEF CEPHALOPOD,*,*,Marine mollusk characterized by well-developed head and eyes and sucker-bearing tentacles; Relating or belonging to the class Cephalopoda.,wndefs0.aiml
0,WNDEF MARINE,*,*,A member of the United States Marine Corps; Of or relating to the sea; Native to or inhabiting the sea; Of or relating to military personnel who serve both on land and at sea (specifically the U.S. Marine Corps).,wndefs0.aiml
0,WNDEF STRAIGHT-BILLED,*,*,Having a straight beak.,wndefs0.aiml
0,WNDEF MARINI,*,*,Italian poet (1569-1625).,wndefs0.aiml
0,WNDEF LOCALLY,*,*,By a particular locality; To a restricted area of the body.,wndefs0.aiml
0,WNDEF SANTA CRUZ CYPRESS,*,*,Rare California cypress taller than but closely related to gowen cypress and sometimes considered the same species.,wndefs0.aiml
0,WNDEF UVULARIACEAE,*,*,One of many subfamilies into which some classification systems subdivide the Liliaceae.,wndefs0.aiml
0,WNDEF BLOOD COUNT,*,*,The act of estimating the number of red and white corpuscles in a blood sample; The number of red and white corpuscles in a blood sample.,wndefs0.aiml
0,WNDEF RULER,*,*,A person who rules or commands.,wndefs0.aiml
0,WNDEF MANUAL,*,*,A small handbook; Requiring human effort; Of or relating to the hands; Doing or requiring physical work.,wndefs0.aiml
0,WNDEF RULED,*,*,Subject to a ruling authority.,wndefs0.aiml
0,WNDEF BANK FAILURE,*,*,The inability of a bank to meet its credit obligations.,wndefs0.aiml
0,WNDEF DANDELION GREEN,*,*,Edible leaves of the common dandelion collected from the wild; used in salads and in making wine.,wndefs0.aiml
0,WNDEF OSCAN-SPEAKING,*,*,Able to communicate in Oscan.,wndefs0.aiml
0,WNDEF TOPIC SENTENCE,*,*,A sentence that states the topic of its paragraph.,wndefs0.aiml
0,WNDEF MOTHERWELL,*,*,United States abstract expressionist painter (1915-1991).,wndefs0.aiml
0,WNDEF READJUSTMENT,*,*,The act of adjusting again (to changed circumstances).,wndefs0.aiml
0,WNDEF MILK LEG,*,*,Painful thrombosis of the femoral vein in the leg following childbirth.,wndefs0.aiml
0,WNDEF VIAND,*,*,A choice or delicious dish.,wndefs0.aiml
0,WNDEF CURASSOW,*,*,Large crested arboreal game bird of warm parts of the Americas having long legs and tails; highly esteemed as game and food.,wndefs0.aiml
0,WNDEF ABDOMINAL BREATHING,*,*,Breathing in which most of the respiratory effort is done by the abdominal muscles.,wndefs0.aiml
0,WNDEF SPURIOUSNESS,*,*,State of lacking genuineness.,wndefs0.aiml
0,WNDEF TADARIDA,*,*,Freetail bats.,wndefs0.aiml
0,WNDEF WAREHOUSE,*,*,A storehouse for goods and merchandise; Store in a warehouse.,wndefs0.aiml
0,WNDEF UNSTINTINGLY,*,*,In an unstinting manner.,wndefs0.aiml
0,WNDEF CALASH,*,*,The folding hood of a horse-drawn carriage; A woman's large folded hooped hood; worn in the 18th century.,wndefs0.aiml
0,WNDEF WRONGLY,*,*,Without justice or fairness.,wndefs0.aiml
0,WNDEF VISCACHA,*,*,Gregarious burrowing rodent larger than the chinchillas.,wndefs0.aiml
0,WNDEF RETURN KEY,*,*,The key on electric typewriters or computer keyboards that causes a carriage return and a line feed.,wndefs0.aiml
0,WNDEF NICHOLAS II,*,*,The last czar of Russia who was forced to abdicate in 1917 by the Russian Revolution; he and his family were executed by the Bolsheviks (1868-1918).,wndefs0.aiml
0,WNDEF SYSTEMATIC,*,*,Characterized by order and planning.,wndefs0.aiml
0,WNDEF PREPUBERTY,*,*,A period of two years immediately prior to the onset of puberty when growth and changes leading to sexual maturity occur.,wndefs0.aiml
0,WNDEF GROSS SALES,*,*,Income (at invoice values) received for goods and services over some given period of time.,wndefs0.aiml
0,WNDEF CREDIT CRUNCH,*,*,A state in which there is a short supply of cash to lend to businesses and consumers and interest rates are high.,wndefs0.aiml
0,WNDEF CARPETBAGGER,*,*,An outsider who seeks power or success presumptuously.,wndefs0.aiml
0,WNDEF DESTALINIZE,*,*,Counteract the effects and policies of Stalinism.,wndefs0.aiml
0,WNDEF PONTUS,*,*,Ancient personification of the sea; father of Nereus; An ancient region of northern Asia Minor on the Black Sea; it reached its height under Mithridates VI but was later incorporated into the Roman Empire.,wndefs0.aiml
0,WNDEF STANHOPE,*,*,A light open horse-drawn carriage with two or four wheels and one seat.,wndefs0.aiml
0,WNDEF PASCAL,*,*,A unit of pressure equal to one newton per square meter; A programing language designed to teach programming through a top-down modular approach; French mathematician and philosopher and Jansenist; invented an adding machine; contributed (with Fermat) to the theory of probability (1623-1662).,wndefs0.aiml
0,WNDEF WILD PITCH,*,*,An errant pitch that the catcher cannot be expected to catch and that allows a base runner to advance a base.,wndefs0.aiml
0,WNDEF JARRING,*,*,Making or causing a harsh and irritating sound.,wndefs0.aiml
0,WNDEF SAINT JOHNS,*,*,A river in northeastern Florida that flows northward to Jacksonville and then eastward to empty into the Atlantic Ocean.,wndefs0.aiml
0,WNDEF BATTLE DAMAGE,*,*,Loss of military equipment in battle.,wndefs0.aiml
0,WNDEF TURBIDITY,*,*,Muddiness created by stirring up sediment or having foreign particles suspended.,wndefs0.aiml
0,WNDEF ANNOYING,*,*,Causing irritation or annoyance.,wndefs0.aiml
0,WNDEF GRAPHIC ART,*,*,The arts of drawing or painting or printmaking.,wndefs0.aiml
0,WNDEF EUREKA,*,*,A town in northwest California on an arm of the Pacific Ocean.,wndefs0.aiml
0,WNDEF SACRIFICIAL,*,*,Used in or connected with a sacrifice.,wndefs0.aiml
0,WNDEF MENYANTHES,*,*,The type genus of the Menyanthaceae; one species.,wndefs0.aiml
0,WNDEF SCANDAL,*,*,Disgraceful gossip about the private lives of other people; A disgraceful event.,wndefs0.aiml
0,WNDEF RIVAL,*,*,The contestant you hope to defeat; Be the rival of#Comma be in competition with something.,wndefs0.aiml
0,WNDEF MYOFIBRIL,*,*,One of many contractile filaments that make up a striated muscle fiber.,wndefs0.aiml
0,WNDEF ICE TONGS,*,*,Tongs for lifting blocks of ice.,wndefs0.aiml
0,WNDEF SASKATOON,*,*,Edible purple or red berries; A city in central Saskatchewan; the largest city in the province.,wndefs0.aiml
0,WNDEF ZOOSPORE,*,*,An asexual spore of some algae and fungi that moves by means of flagella.,wndefs0.aiml
0,WNDEF DRAMATIC PRODUCTION,*,*,The act of performing a drama.,wndefs0.aiml
0,WNDEF HAUTE-NORMANDIE,*,*,A division of Normandy.,wndefs0.aiml
0,WNDEF ICHTHYOSAUR,*,*,Any of several marine reptiles of the Mesozoic having a body like a porpoise with dorsal and tail fins and paddle-shaped limbs.,wndefs0.aiml
0,WNDEF EQUILIBRATION,*,*,Stabilization by bringing into equilibrium.,wndefs0.aiml
0,WNDEF HISTORIOGRAPHY,*,*,A body of historical literature; The writing of history.,wndefs0.aiml
0,WNDEF CUBAN MONETARY UNIT,*,*,Monetary unit in Cuba.,wndefs0.aiml
0,WNDEF OSSETE,*,*,A northeastern Iranian language spoken in Russia.,wndefs0.aiml
0,WNDEF SUNHAT,*,*,A hat with a broad brim that protects the face from direct exposure to the sun.,wndefs0.aiml
0,WNDEF HEIRESS,*,*,A female heir.,wndefs0.aiml
0,WNDEF HOUSEWIFERY,*,*,The work of a housewife.,wndefs0.aiml
0,WNDEF WELL-BRED,*,*,Of good upbringing.,wndefs0.aiml
0,WNDEF LARDER,*,*,A supply of food especially for a household.,wndefs0.aiml
0,WNDEF INTERNATIONAL LAW ENFORCEMENT AGENCY,*,*,An international administrative unit responsible for law enforcement.,wndefs0.aiml
0,WNDEF STRICKLE,*,*,An implement for sharpening scythes; Smooth with a strickle; Level off with a strickle in a measuring container; A tool used in a foundry to shape a mold in sand; A tool used to level off grain or other granular material in a measure.,wndefs0.aiml
0,WNDEF LEXICOLOGY,*,*,The branch of linguistics that studies the lexical component of language.,wndefs0.aiml
0,WNDEF BLACK-NECKED STILT,*,*,Stilt of southwestern United States to northern South America having black plumage extending from the head down the back of the neck.,wndefs0.aiml
0,WNDEF RIPTIDE,*,*,A strong surface current flowing outwards from a shore.,wndefs0.aiml
0,WNDEF JAPANESE POINSETTIA,*,*,Showy poinsettia found from the southern United States to Peru.,wndefs0.aiml
0,WNDEF SLAVER,*,*,A person engaged in slave trade.,wndefs0.aiml
0,WNDEF DEHYDROGENATE,*,*,Remove hydrogen from something.,wndefs0.aiml
0,WNDEF UNCOMPLAINING,*,*,Not complaining.,wndefs0.aiml
0,WNDEF LEOPARDESS,*,*,Female leopard.,wndefs0.aiml
0,WNDEF COAUTHOR,*,*,A writer who collaborates with others in writing something.,wndefs0.aiml
0,WNDEF WHOOPEE,*,*,Noisy and boisterous revelry.,wndefs0.aiml
0,WNDEF SLEEPER NEST,*,*,A nest of sleepers awaiting a prearranged signal.,wndefs0.aiml
0,WNDEF DRAVIDIAN,*,*,A large family of languages spoken in south and central India and Sri Lanka; A member of one of the aboriginal races of India (pushed south by Caucasians and now mixed with them).,wndefs0.aiml
0,WNDEF LOUDMOUTH,*,*,A person who causes trouble by speaking indiscreetly.,wndefs0.aiml
0,WNDEF BARTLESVILLE,*,*,A town in northeastern Oklahoma.,wndefs0.aiml
0,WNDEF ECHOENCEPHALOGRAM,*,*,A graphical image of the brain produced by an echoencephalograph.,wndefs0.aiml
0,WNDEF COFFEE MUG,*,*,A mug intended for serving coffee.,wndefs0.aiml
0,WNDEF CARPENTRY,*,*,The craft of a carpenter.,wndefs0.aiml
0,WNDEF MUJAHEDEEN KOMPAK,*,*,A militant Islamic militia that was formed in 2004 by hardliners who split from Jemaah Islamiyah.,wndefs0.aiml
0,WNDEF RETRAL,*,*,At or near or toward the posterior; Moving or directed or tending in a backward direction or contrary to a previous direction.,wndefs0.aiml
0,WNDEF QUEEN'S COUNSEL,*,*,Counsel to the Crown when the British monarch is a queen.,wndefs0.aiml
0,WNDEF ANGLOPHILE,*,*,An admirer of England and things English.,wndefs0.aiml
0,WNDEF FATEFUL,*,*,Of ominous significance; Having momentous consequences; of decisive importance.,wndefs0.aiml
0,WNDEF DEAD AIR,*,*,An inadvertent interruption in a broadcast during which there is no sound.,wndefs0.aiml
0,WNDEF LATIN SQUARE,*,*,A square matrix of n rows and columns; cells contain n different symbols so arranged that no symbol occurs more than once in any row or column.,wndefs0.aiml
0,WNDEF EOLITH,*,*,A crude stone artifact (as a chipped flint); possibly the earliest tools.,wndefs0.aiml
0,WNDEF RAGLAN SLEEVE,*,*,A sleeve that extends in one piece to the neckline of a coat or sweater with seams from the armhole to the neck.,wndefs0.aiml
0,WNDEF CONFORMAL PROJECTION,*,*,A map projection in which a small area is rendered in its true shape.,wndefs0.aiml
0,WNDEF TENTACLED,*,*,Having tentacles.,wndefs0.aiml
0,WNDEF HOOFLIKE,*,*,Resembling a hoof; especially having the horny texture of a hoof.,wndefs0.aiml
0,WNDEF TRANSFUSION REACTION,*,*,Reaction of the body to a transfusion of blood that is not compatible with its own blood; an adverse reaction can range from fever and hives to renal failure and shock and death.,wndefs0.aiml
0,WNDEF ASSONANCE,*,*,The repetition of similar vowels in the stressed syllables of successive words.,wndefs0.aiml
0,WNDEF UNENFORCEABLE,*,*,Not enforceable; not capable of being brought about by compulsion.,wndefs0.aiml
0,WNDEF SCUTE,*,*,Large bony or horny plate as on an armadillo or turtle.,wndefs0.aiml
0,WNDEF CESTODA,*,*,Tapeworms.,wndefs0.aiml
0,WNDEF REBUS,*,*,A puzzle where you decode a message consisting of pictures representing syllables and words.,wndefs0.aiml
0,WNDEF AMBASSADORIAL,*,*,Of or relating to or characteristic of ambassadors.,wndefs0.aiml
0,WNDEF MONITOR,*,*,Electronic equipment that is used to check the quality or content of electronic transmissions; Display produced by a device that takes signals and displays them on a television screen or a computer monitor; An ironclad vessel built by Federal forces to do battle with the Merrimac; Keep tabs on; keep an eye on; keep under surveillance; Any of various large tropical carnivorous lizards of Africa and Asia and Australia; fabled to warn of crocodiles.,wndefs0.aiml
0,WNDEF CARPHOPHIS,*,*,Thunder snake.,wndefs0.aiml
0,WNDEF CELASTRUS,*,*,Type genus of the Celastraceae.,wndefs0.aiml
0,WNDEF LISTEN IN,*,*,Listen without the speaker's knowledge; Listen quietly#Comma without contributing to the conversation.,wndefs0.aiml
0,WNDEF STEEPISH,*,*,Somewhat steep.,wndefs0.aiml
0,WNDEF ZESTFUL,*,*,Marked by spirited enjoyment.,wndefs0.aiml
0,WNDEF DEVALUE,*,*,Lower the value or quality of; Remove the value from; deprive something of its value.,wndefs0.aiml
0,WNDEF SPANISH NEEDLES,*,*,Common bur marigold of the eastern United States; The seed of bur marigolds.,wndefs0.aiml
0,WNDEF HEJAZ,*,*,A coastal region of the western Arabian Peninsula bordering on the Red Sea; includes both Mecca and Medina; formerly an independent kingdom until it united with Nejd to form the Kingdom of Saudi Arabia.,wndefs0.aiml
0,WNDEF CONGRESSMAN,*,*,A member of the United States House of Representatives.,wndefs0.aiml
0,WNDEF AESTHETICS,*,*,The branch of philosophy dealing with beauty and taste (emphasizing the evaluative criteria that are applied to art).,wndefs0.aiml
0,WNDEF MASS ENERGY,*,*,The mass of a body regarded relativistically as energy.,wndefs0.aiml
0,WNDEF SOURPUSS,*,*,Someone with a habitually sullen or gloomy expression.,wndefs0.aiml
0,WNDEF SPIRITUALLY,*,*,In a spiritual manner.,wndefs0.aiml
0,WNDEF DISPARATE,*,*,Including markedly dissimilar elements; Fundamentally different or distinct in quality or kind.,wndefs0.aiml
0,WNDEF RESPIRATORY SYSTEM,*,*,The system for taking in oxygen and giving off carbon dioxide; in terrestrial animals this is accomplished by breathing.,wndefs0.aiml
0,WNDEF TIDINESS,*,*,The trait of being neat and orderly; The habit of being tidy.,wndefs0.aiml
0,WNDEF CYCLOPTERUS,*,*,Type genus of the Cyclopteridae.,wndefs0.aiml
0,WNDEF BEARING REIN,*,*,A rein designed to keep the horse's head in the desired position.,wndefs0.aiml
0,WNDEF SHEIKA,*,*,The wife of a sheik.,wndefs0.aiml
0,WNDEF COMPACTNESS,*,*,The consistency of a compact solid.,wndefs0.aiml
0,WNDEF PRICE FREEZE,*,*,Freeze of prices at a given level.,wndefs0.aiml
0,WNDEF MILITARY ACADEMY,*,*,An academy for training military officers.,wndefs0.aiml
0,WNDEF BLACK-BILLED CUCKOO,*,*,North American cuckoo; builds a nest and rears its own young.,wndefs0.aiml
0,WNDEF TROPIC OF CANCER,*,*,A line of latitude about 23 degrees North of the equator.,wndefs0.aiml
0,WNDEF TRIIODOTHYRONINE,*,*,Thyroid hormone similar to thyroxine but with one less iodine atom per molecule and produced in smaller quantity; exerts the same biological effects as thyroxine but is more potent and briefer.,wndefs0.aiml
0,WNDEF OCCURRENT,*,*,Presently occurring (either causally or incidentally).,wndefs0.aiml
0,WNDEF STORYLINE,*,*,The plot of a book or play or film.,wndefs0.aiml
0,WNDEF RHESUS,*,*,Of southern Asia; used in medical research.,wndefs0.aiml
0,WNDEF WIRETAP,*,*,The act of tapping a telephone or telegraph line to get information; Tap something a telephone or telegraph wire to get information.,wndefs0.aiml
0,WNDEF BICEPS,*,*,Any skeletal muscle having two origins (but especially the muscle that flexes the forearm).,wndefs0.aiml
0,WNDEF KARYOLYSIS,*,*,Disintegration and dissolution of a cell nucleus when a cell dies.,wndefs0.aiml
0,WNDEF NEUROMUSCULAR,*,*,Affecting or characteristic of both neural and muscular tissue.,wndefs0.aiml
0,WNDEF BATTLE OF WITS,*,*,A contest in which intelligence rather than violence is used.,wndefs0.aiml
0,WNDEF CALCEOLATE,*,*,Of slipper-shaped blossoms.,wndefs0.aiml
0,WNDEF SCURF,*,*,A covering that resembles scales or bran that covers some plant parts.,wndefs0.aiml
0,WNDEF REAPPEARANCE,*,*,The act of someone appearing again; The event of something appearing again.,wndefs0.aiml
0,WNDEF BAWDRY,*,*,Lewd or obscene talk or writing.,wndefs0.aiml
0,WNDEF PRECAST,*,*,Of structural members especially of concrete; cast something into form before being transported to the site of installation.,wndefs0.aiml
0,WNDEF NO-HIT GAME,*,*,A game in which a pitcher allows the opposing team no hits.,wndefs0.aiml
0,WNDEF EASTWARD,*,*,Toward the east.,wndefs0.aiml
0,WNDEF NEVER,*,*,Not ever; at no time in the past or future; Not at all; certainly not; not in any circumstances.,wndefs0.aiml
0,WNDEF SUBCORTICAL,*,*,Of or relating to or being or involving nerve centers below the cerebral cortex.,wndefs0.aiml
0,WNDEF SLAVIC,*,*,A branch of the Indo-European family of languages.,wndefs0.aiml
0,WNDEF SPHENOID BONE,*,*,Butterfly-shaped bone at the base of the skull.,wndefs0.aiml
0,WNDEF DRAW A BEAD ON,*,*,Aim with a gun; Have an ambitious plan or a lofty goal.,wndefs0.aiml
0,WNDEF KERBALA,*,*,A city of central Iraq south of Baghdad; a holy city for Shiite Muslims because it is the site of the tomb of Mohammed's grandson who was killed there in 680.,wndefs0.aiml
0,WNDEF LESBOS,*,*,An island of eastern Greece in the eastern Aegean Sea; in antiquity it was famous for lyric poetry.,wndefs0.aiml
0,WNDEF SANDHI,*,*,The articulatory process whereby the pronunciation of a word or morpheme changes when it is followed immediately by another (especially in fluent speech).,wndefs0.aiml
0,WNDEF BIRD FAMILY,*,*,A family of warm-blooded egg-laying vertebrates characterized by feathers and forelimbs modified as wings.,wndefs0.aiml
0,WNDEF SHIRTSLEEVES,*,*,Not wearing a jacket.,wndefs0.aiml
0,WNDEF CONTAMINATION,*,*,The act of or ; including (either intentionally or polluting accidentally ) unwanted substances or factors; The state of being contaminated.,wndefs0.aiml
0,WNDEF MOO GOO GAI PAN,*,*,A Cantonese dish of chicken and sauted vegetables.,wndefs0.aiml
0,WNDEF HENRY IV,*,*,The first Lancastrian king of England from 1399 to 1413; deposed Richard II and suppressed rebellions (1367-1413); King of the Germans and Holy Roman Emperor (1050-1106).,wndefs0.aiml
0,WNDEF GOVERN,*,*,Direct something or strongly influence the behavior of SOMETHING_2; Exercise authority over; as of nations; Require to be in a certain grammatical case#Comma voice#Comma or mood.,wndefs0.aiml
0,WNDEF MANURE,*,*,Any animal or plant material used to fertilize land especially animal excreta usually with litter material; Spread manure#Comma as for fertilization.,wndefs0.aiml
0,WNDEF ENDAMEBA,*,*,Any ameba of the genus Endamoeba.,wndefs0.aiml
0,WNDEF DRESSMAKER,*,*,Someone who makes or mends dresses.,wndefs0.aiml
0,WNDEF BERYLLIUM BRONZE,*,*,A copper-base alloy containing beryllium.,wndefs0.aiml
0,WNDEF LAWN CHAIR,*,*,Chair left outside for use on a lawn or in a garden.,wndefs0.aiml
0,WNDEF BLESSED EVENT,*,*,The live birth of a child.,wndefs0.aiml
0,WNDEF POST ROAD,*,*,A road over which mail is carried.,wndefs0.aiml
0,WNDEF HORSE-AND-BUGGY,*,*,Relating to the time before automobiles (and other inventions) changed the way people lived in industrialized nations.,wndefs0.aiml
0,WNDEF CHEAPJACK,*,*,A peddler of inferior goods; Cheap and shoddy.,wndefs0.aiml
0,WNDEF HYDROSTATIC,*,*,Relating to fluids at rest or to the pressures they exert or transmit.,wndefs0.aiml
0,WNDEF AUTHENTICITY,*,*,Undisputed credibility.,wndefs0.aiml
0,WNDEF LANCE,*,*,Open by piercing with a lancet; Pierce something with a lance#Comma as in a knights' fight; Move quickly#Comma as if by cutting one's way.,wndefs0.aiml
0,WNDEF SHEET BEND,*,*,A hitch used for temporarily tying a rope to the middle of another rope (or to an eye).,wndefs0.aiml
0,WNDEF UNDERARM,*,*,With the hand swung something below shoulder level.,wndefs0.aiml
0,WNDEF DAMSELFISH,*,*,Small brilliantly colored tropical marine fishes of coral reefs.,wndefs0.aiml
0,WNDEF HENRY II,*,*,First Plantagenet King of England; instituted judicial and financial reforms; quarreled with archbishop Becket concerning the authority of the crown over the church (1133-1189); King of France from 1547 to 1559; regained Calais from the English; husband of Catherine de Medicis and father of Charles IX (1519-1559).,wndefs0.aiml
0,WNDEF ENTEROBIASIS,*,*,An infestation with or a resulting infection caused by the pinworm Enterobius vermicularis; occurs especially in children.,wndefs0.aiml
0,WNDEF HOLDING PATTERN,*,*,A state of inaction with no progress and no change; The flight path (usually circular) maintained by an aircraft that is awaiting permission to land.,wndefs0.aiml
0,WNDEF FUSARIUM WILT,*,*,Wilt caused by fungi of the genus Fusarium.,wndefs0.aiml
0,WNDEF ESCADRILLE,*,*,A small squadron; An air force squadron typically containing six airplanes (as in France during World War I).,wndefs0.aiml
