0,WNDEF *,*,*,unknown,wndefs0.aiml
0,WNDEF DESPERATE STRAITS,*,*,A state of extreme distress.,wndefs0.aiml
0,WNDEF DRAMATICALLY,*,*,In a dramatic manner; With respect to dramatic value; In a very impressive manner.,wndefs0.aiml
0,WNDEF COMMON SHINER,*,*,The common North American shiner.,wndefs0.aiml
0,WNDEF WHITE NOISE,*,*,A shnoise produced by a stimulus containing all audible frequencies of vibration.,wndefs0.aiml
0,WNDEF MASS-ENERGY EQUIVALENCE,*,*,The principle that a measured quantity of mass is equivalent (according to relativity theory) to a measured quantity of energy.,wndefs0.aiml
0,WNDEF CODE,*,*,The symbolic arrangement of data or instructions in a computer program or the set of such instructions; A set of rules or principles or laws (especially written ones); Attach a code to something; A coding system used for transmitting messages requiring brevity or secrecy.,wndefs0.aiml
0,WNDEF OYSTER CRAB,*,*,Tiny soft-bodied crab living within the mantle cavity of oysters.,wndefs0.aiml
0,WNDEF BASEBALL COACH,*,*,A coach of baseball players.,wndefs0.aiml
0,WNDEF MOUSSE,*,*,Apply a styling gel to something; Toiletry consisting of an aerosol foam used in hair styling; A light creamy dish made from fish or meat and set with gelatin.,wndefs0.aiml
0,WNDEF CIRCUMFLEX HUMERAL ARTERY,*,*,An artery that supplies the shoulder joint and shoulder muscles.,wndefs0.aiml
0,WNDEF ABIOGENIST,*,*,A believer in abiogenesis.,wndefs0.aiml
0,WNDEF FATIGUE FRACTURE,*,*,Fracture resulting from excessive activity rather than a specific injury.,wndefs0.aiml
0,WNDEF FUNGUS FAMILY,*,*,Includes lichen families.,wndefs0.aiml
0,WNDEF TOBOGGANIST,*,*,Someone who rides a toboggan.,wndefs0.aiml
0,WNDEF LARGE,*,*,A garment size for a large person; Above average in size or number or quantity or magnitude or extent; Having broad power and range and scope; At a distance#Comma wide of something (as of a mark).,wndefs0.aiml
0,WNDEF BOEHMERIA,*,*,False nettle.,wndefs0.aiml
0,WNDEF HUMBER BRIDGE,*,*,A suspension bridge at Hull#Comma England; 4#Comma626 feet long.,wndefs0.aiml
0,WNDEF BECKLEY,*,*,A city in southern West Virginia.,wndefs0.aiml
0,WNDEF LARGO,*,*,Slowly and broadly; A composition or passage that is to be performed in a slow and dignified manner.,wndefs0.aiml
0,WNDEF LIBRARY FINE,*,*,Fine imposed by a library on books that overdue when returned.,wndefs0.aiml
0,WNDEF SQUALIDAE,*,*,Dogfishes having a spine in each dorsal fin.,wndefs0.aiml
0,WNDEF COAL,*,*,Fossil fuel consisting of carbonized vegetable matter deposited in the Carboniferous period; Take in coal; Supply with coal.,wndefs0.aiml
0,WNDEF COAT,*,*,Growth of hair or wool or fur covering the body of an animal; Cover or provide with a coat; Form a coat over; Put a coat on; cover the surface of; furnish with a surface; An outer garment that has sleeves and covers the body from shoulder down; worn outdoors.,wndefs0.aiml
0,WNDEF CALENDAR,*,*,A list or register of events (appointments or social events or court cases etc); A tabular array of the days (usually for one year); Enter into a calendar.,wndefs0.aiml
0,WNDEF SCHEMATICALLY,*,*,In a schematic manner.,wndefs0.aiml
0,WNDEF NORTHUMBERLAND,*,*,The northernmost county of England; has many Roman remains (including Hadrian's Wall).,wndefs0.aiml
0,WNDEF PHILOGYNY,*,*,Admiration for women.,wndefs0.aiml
0,WNDEF PLECTANIA,*,*,Genus of fungi in the family Pezizaceae closely related to and often included in genus Peziza.,wndefs0.aiml
0,WNDEF DECORATION,*,*,The act of decorating something (in the hope of making it more attractive); An award for winning a championship or commemorating some other event; Something used to beautify.,wndefs0.aiml
0,WNDEF RIBBON-SHAPED,*,*,Shaped in the form of a ribbon.,wndefs0.aiml
0,WNDEF ECONOMIC MOBILIZATION,*,*,Mobilization of the economy.,wndefs0.aiml
0,WNDEF BAGHDAD,*,*,Capital and largest city of Iraq; located on the Tigris River.,wndefs0.aiml
0,WNDEF PLEASANTNESS,*,*,The quality of giving pleasure; The feeling caused by agreeable stimuli; one pole of a continuum of states of feeling.,wndefs0.aiml
0,WNDEF INTUMESCENCE,*,*,The swelling of certain substances when they are heated (often accompanied by release of water); Swelling up with blood or other fluids (as with congestion).,wndefs0.aiml
0,WNDEF PSEUDONYM,*,*,A fictitious name used when the person performs a particular social role.,wndefs0.aiml
0,WNDEF FIRTH OF FORTH,*,*,A large firth on the east coast of Scotland and the estuary of the Forth River; location of Edinburgh.,wndefs0.aiml
0,WNDEF ROUND-BOTTOMED,*,*,Having a rounded bottom.,wndefs0.aiml
0,WNDEF BOBCAT,*,*,Small lynx of North America.,wndefs0.aiml
0,WNDEF ATELEIOTIC,*,*,Of or relating to ateleiosis.,wndefs0.aiml
0,WNDEF STYLISHLY,*,*,In a stylish manner.,wndefs0.aiml
0,WNDEF KNIGHTHOOD,*,*,Aristocrats holding the rank of knight.,wndefs0.aiml
0,WNDEF LARID,*,*,Long-winged web-footed aquatic bird of the gull family.,wndefs0.aiml
0,WNDEF DEADNESS,*,*,The inanimate property of something that has died; The physical property of something that has lost its elasticity.,wndefs0.aiml
0,WNDEF PERFUMERY,*,*,Perfumes in general; The art of making perfumes; An establishment where perfumes are made; Store where perfumes are sold.,wndefs0.aiml
0,WNDEF MACROMOLECULAR,*,*,Relating to or consisting of or characterized by macromolecules.,wndefs0.aiml
0,WNDEF KNOBKERRIE,*,*,A short wooden club with a heavy knob on one end; used by aborigines in southern Africa.,wndefs0.aiml
0,WNDEF KNIGHT ERRANTRY,*,*,Quixotic (romantic and impractical) behavior.,wndefs0.aiml
0,WNDEF SPRAGUEA,*,*,Small genus of usually perennial herbs having deep woody taproots and flower heads of umbels or cymes.,wndefs0.aiml
0,WNDEF PAINTED BEAUTY,*,*,American butterfly having dark brown wings with white and golden orange spots.,wndefs0.aiml
0,WNDEF AL-TAWHID,*,*,An Islamic terrorist cell that originated in Jordan but operates in Germany; goal is to attack Europe and Russia with chemical weapons.,wndefs0.aiml
0,WNDEF RESPIRATORY ORGAN,*,*,Any organ involved in the process of respiration.,wndefs0.aiml
0,WNDEF HAND FERN,*,*,Tropical American fern with coarsely lobed to palmatifid fronds.,wndefs0.aiml
0,WNDEF GOLDCREST,*,*,European kinglet with a black-bordered yellow crown patch.,wndefs0.aiml
0,WNDEF HYPOGLYCEMIC,*,*,Of or relating to hypoglycemia.,wndefs0.aiml
0,WNDEF UNCONSCIOUSLY,*,*,Without awareness.,wndefs0.aiml
0,WNDEF PHOBIC,*,*,Suffering from irrational fears.,wndefs0.aiml
0,WNDEF STRATEGIC BUYOUT,*,*,An acquisition based on analysis of the benefits of consolidation in anticipation of increased earning power.,wndefs0.aiml
0,WNDEF SANGAREE,*,*,Sweetened red wine and orange or lemon juice with soda water.,wndefs0.aiml
0,WNDEF PHOBIA,*,*,An anxiety disorder characterized by extreme and irrational fear of simple things or social situations.,wndefs0.aiml
0,WNDEF NICOLSON,*,*,English diplomat and author (1886-1968).,wndefs0.aiml
0,WNDEF RELATIVISTIC MASS,*,*,The mass of a body in motion relative to the observer.,wndefs0.aiml
0,WNDEF METATARSAL,*,*,Any bone of the foot between the ankle and the toes; Of or relating to the metatarsus.,wndefs0.aiml
0,WNDEF BRAVURA,*,*,Brilliant and showy technical skill.,wndefs0.aiml
0,WNDEF LUXEMBOURGIAN,*,*,Relating to or characteristic of Luxembourg.,wndefs0.aiml
0,WNDEF MANEUVERER,*,*,A person skilled in maneuvering.,wndefs0.aiml
0,WNDEF CONSUMER GOODS,*,*,Goods (as food or clothing) intended for direct use or consumption.,wndefs0.aiml
0,WNDEF RHINOCEROTIDAE,*,*,Rhinoceroses.,wndefs0.aiml
0,WNDEF BRAHMAPUTRA,*,*,An Asian river; flows into the Bay of Bengal.,wndefs0.aiml
0,WNDEF LIGHT YEAR,*,*,The distance that light travels in a vacuum in 1 year; 5.88 trillion miles or 9.46 trillion kilometers.,wndefs0.aiml
0,WNDEF NEOCOLONIALISM,*,*,Control by a powerful country of its former colonies (or other less developed countries) by economic pressures.,wndefs0.aiml
0,WNDEF DIMMER,*,*,A rheostat that varies the current through an electric light in order to control the level of illumination.,wndefs0.aiml
0,WNDEF MISHNAIC,*,*,Of or relating to the Mishna (the first part of the Talmud).,wndefs0.aiml
0,WNDEF MONETARY UNIT,*,*,A monetary unit.,wndefs0.aiml
0,WNDEF NORTHERN BOBWHITE,*,*,A favorite game bird of eastern and central United States.,wndefs0.aiml
0,WNDEF UNBOOKED,*,*,Not reserved something in advance.,wndefs0.aiml
0,WNDEF THERAPEUTIC CLONING,*,*,Nuclear transplantation of a patient's own cells to make an oocyte from which immune-compatible cells (especially stem cells) can be derived for transplant.,wndefs0.aiml
0,WNDEF ABSTRACTION,*,*,A general concept formed by extracting common features from specific examples; The process of formulating general concepts by abstracting common properties of instances; An abstract painting; The act of withdrawing or removing something; A concept or idea not associated with any specific instance.,wndefs0.aiml
0,WNDEF RECORDER,*,*,Equipment for making records; A barrister or solicitor who serves as part-time judge in towns or boroughs.,wndefs0.aiml
0,WNDEF RECORDED,*,*,Recorded or listed in a directory; (of securities) having the owner's name entered in a register.,wndefs0.aiml
0,WNDEF COMPLIANT,*,*,Disposed or willing to comply.,wndefs0.aiml
0,WNDEF HULA-HOOP,*,*,Plaything consisting of a tubular plastic hoop for swinging around the hips.,wndefs0.aiml
0,WNDEF PLEDGE,*,*,A deposit of personal property as security for a debt; Promise solemnly and formally; Give something as a guarantee; A drink in honor of or to the health of a person or event; Bind or secure by a pledge; Pay (an amount of money) as a contribution to a charity or service#Comma especially at regular intervals.,wndefs0.aiml
0,WNDEF FRISK,*,*,The act of searching someone for concealed weapons or illegal drugs; Search something as for concealed weapons by running the hands rapidly over the clothing and through the pockets.,wndefs0.aiml
0,WNDEF CALORIFIC,*,*,Heat-generating.,wndefs0.aiml
0,WNDEF DIMMED,*,*,Made something dim or less bright.,wndefs0.aiml
0,WNDEF STATE SOCIALISM,*,*,An economic system in which the government owns most means of production but some degree of private capitalism is allowed.,wndefs0.aiml
0,WNDEF CONDEMNATION,*,*,The act of condemning (as land forfeited for public use) or judging to be unfit for use (as a food product or an unsafe building).,wndefs0.aiml
0,WNDEF DEXTERITY,*,*,Adroitness in using the hands.,wndefs0.aiml
0,WNDEF ACTINOPODA,*,*,Heliozoans; radiolarians.,wndefs0.aiml
0,WNDEF MAINTAINABLE,*,*,Capable of being maintained.,wndefs0.aiml
0,WNDEF GENICULATE BODY,*,*,One of four small oval masses that protrude slightly from the underside of the thalamus and function as synaptic centers on the way to the cerebral cortex.,wndefs0.aiml
0,WNDEF QUIZ,*,*,An examination consisting of a few short questions; Examine someone's knowledge of something.,wndefs0.aiml
0,WNDEF AXILLARY,*,*,Of or relating to the armpit; Of or relating to the axil.,wndefs0.aiml
0,WNDEF POLAROGRAPHIC,*,*,Of or involving polarography.,wndefs0.aiml
0,WNDEF SIBLEY TENT,*,*,A light conical canvas tent erected on a tripod with ventilation at the top.,wndefs0.aiml
0,WNDEF NONIONIC,*,*,Not ionic.,wndefs0.aiml
0,WNDEF LARCH,*,*,Wood of a larch tree; Any of numerous conifers of the genus Larix all having deciduous needlelike leaves.,wndefs0.aiml
0,WNDEF INTROVERT,*,*,Turn inside something; A person who tends to shrink from social contacts and to become preoccupied with their own thoughts.,wndefs0.aiml
0,WNDEF YOUTH MOVEMENT,*,*,Political or religious or social reform movement or agitation consisting chiefly of young people.,wndefs0.aiml
0,WNDEF PROTHALAMION,*,*,A song in celebration of a marriage.,wndefs0.aiml
0,WNDEF UNFORBEARING,*,*,Unwilling to endure.,wndefs0.aiml
0,WNDEF CORPORATE FINANCE,*,*,The financial activities of corporation.,wndefs0.aiml
0,WNDEF TOBOGGANING,*,*,Riding on a long light sled with low handrails.,wndefs0.aiml
0,WNDEF ELECTRON SHELL,*,*,A grouping of electrons surrounding the nucleus of an atom.,wndefs0.aiml
0,WNDEF MANUSCRIPT,*,*,The form of a literary work submitted for publication; Handwritten book or document.,wndefs0.aiml
0,WNDEF IMPECCABILITY,*,*,The quality of being exempt from sin or incapable of sinning.,wndefs0.aiml
0,WNDEF SCHMUCK,*,*,A jerk.,wndefs0.aiml
0,WNDEF GUINEA,*,*,A republic in western Africa on the Atlantic; formerly a French colony; achieved independence from France in 1958; A former British gold coin worth 21 shillings.,wndefs0.aiml
0,WNDEF LEDGER PAPER,*,*,A durable writing paper used in record books and business ledgers.,wndefs0.aiml
0,WNDEF SIPPER,*,*,A drinker who sips.,wndefs0.aiml
0,WNDEF VERDIN,*,*,Very small yellow-headed titmouse of western North America.,wndefs0.aiml
0,WNDEF UNSELFCONSCIOUSLY,*,*,In an unselfconscious manner.,wndefs0.aiml
0,WNDEF HYPOGLYCEMIA,*,*,Abnormally low blood sugar usually resulting from excessive insulin or a poor diet.,wndefs0.aiml
0,WNDEF NORTH-NORTHWEST,*,*,To#Comma toward#Comma or in the north-northwest.,wndefs0.aiml
0,WNDEF PARRY'S PINYON,*,*,Five-needled pinon of southern California and northern Baja California having (sometimes three-needled or four-needled showing hybridization from Pinus californiarum).,wndefs0.aiml
0,WNDEF HYMENIUM,*,*,Spore-bearing layer of cells in certain fungi containing asci or basidia.,wndefs0.aiml
0,WNDEF FEDERAL DEPOSIT INSURANCE CORPORATION,*,*,A federally sponsored corporation that insures accounts in national banks and other qualified institutions.,wndefs0.aiml
0,WNDEF BYELORUSSIAN,*,*,A native or inhabitant of Byelorussia.,wndefs0.aiml
0,WNDEF GENUS BAROSAURUS,*,*,Huge quadrupedal herbivorous dinosaur; late Jurassic.,wndefs0.aiml
0,WNDEF SUNLIT,*,*,Lighted by sunlight.,wndefs0.aiml
0,WNDEF PRINTING CONCERN,*,*,A company that does commercial printing.,wndefs0.aiml
0,WNDEF REITHRODONTOMYS,*,*,New World harvest mice.,wndefs0.aiml
0,WNDEF MUSTARD,*,*,Leaves eaten as cooked greens; Any of several cruciferous plants of the genus Brassica.,wndefs0.aiml
0,WNDEF CERATOTHERIUM,*,*,African genus.,wndefs0.aiml
0,WNDEF YACHT,*,*,Travel in a yacht; An expensive vessel propelled by sail or power and used for cruising or racing.,wndefs0.aiml
0,WNDEF CHERRY BOMB,*,*,A red ball-shaped firecracker with high explosive power.,wndefs0.aiml
0,WNDEF FLOWER CHAIN,*,*,Flowers strung together in a chain.,wndefs0.aiml
0,WNDEF DEATHBED,*,*,The last few hours before death; The bed on which a person dies.,wndefs0.aiml
0,WNDEF TRANSCORTICAL APHASIA,*,*,A general term for aphasia that results from lesions outside of Broca's area or Wernicke's area of the cerebral cortex.,wndefs0.aiml
0,WNDEF MATTERHORN,*,*,A mountain in the Alps on the border between Switzerland and Italy (14#Comma780 feet high); noted for its distinctive shape.,wndefs0.aiml
0,WNDEF DEIFIC,*,*,Characterized by divine or godlike nature.,wndefs0.aiml
0,WNDEF ANISOMETROPIC,*,*,Relating to a difference in the refractive power of the two eyes.,wndefs0.aiml
0,WNDEF VITAMIN B1,*,*,A B vitamin that prevents beriberi; maintains appetite and growth.,wndefs0.aiml
0,WNDEF ROOT BEER,*,*,Carbonated drink containing extracts of roots and herbs.,wndefs0.aiml
0,WNDEF BLADDER,*,*,A bag that fills with air; A distensible membranous sac (usually containing liquid or gas).,wndefs0.aiml
0,WNDEF VITAMIN B2,*,*,A B vitamin that prevents skin lesions and weight loss.,wndefs0.aiml
0,WNDEF WOOD LILY,*,*,Lily of eastern North America having orange to orange-red purple-spotted flowers.,wndefs0.aiml
0,WNDEF PREPOSITION,*,*,A function word that combines with a noun or pronoun or noun phrase to form a prepositional phrase that can have an adverbial or adjectival relation to some other word; The placing of one linguistic element before another (as placing a modifier before the word it modifies in a sentence or placing an affix before the base to which it is attached).,wndefs0.aiml
0,WNDEF TAWNINESS,*,*,The quality or state of being the color of tanned leather.,wndefs0.aiml
0,WNDEF RIO GRANDE,*,*,A North American river; boundary between the United States and Mexico; flows into Gulf of Mexico.,wndefs0.aiml
0,WNDEF PSYCHOSEXUAL DEVELOPMENT,*,*,The process during which personality and sexual behavior mature through a series of stages.,wndefs0.aiml
0,WNDEF VITAMIN A2,*,*,A viscous alcohol that is less active in mammals than is vitamin A1.,wndefs0.aiml
0,WNDEF VITAMIN A1,*,*,An unsaturated alcohol that occurs in marine fish-liver oils and is synthesized biologically from carotene.,wndefs0.aiml
0,WNDEF PARTNER RELATION,*,*,The responsibility of partners to act in one another's best interests.,wndefs0.aiml
0,WNDEF SHINGLING,*,*,The laying on of shingles.,wndefs0.aiml
0,WNDEF SLOVAKIAN MONETARY UNIT,*,*,Monetary unit in Slovakia.,wndefs0.aiml
0,WNDEF SHALLOW FORDING,*,*,Fording at a shallow place.,wndefs0.aiml
0,WNDEF ASHTRAY,*,*,A receptacle for the ash from smokers' cigars or cigarettes.,wndefs0.aiml
0,WNDEF GIGGLE,*,*,A foolish or nervous laugh; Laugh nervously.,wndefs0.aiml
0,WNDEF INATTENTIVE,*,*,Showing a lack of attention; Not showing due care or attention.,wndefs0.aiml
0,WNDEF HARMFULNESS,*,*,The quality of being noxious; Destructiveness that causes harm or injury.,wndefs0.aiml
0,WNDEF PHOBOS,*,*,The larger of the two satellites of Mars.,wndefs0.aiml
0,WNDEF CROIX DE GUERRE,*,*,A French military decoration for gallantry.,wndefs0.aiml
0,WNDEF MISBEHAVIOR,*,*,Improper or wicked or immoral behavior.,wndefs0.aiml
0,WNDEF AT FAULT,*,*,Deserving blame.,wndefs0.aiml
0,WNDEF CURVET,*,*,A light leap by a horse in which both hind legs leave the ground before the forelegs come down; Perform a leap where both hind legs come off the ground#Comma of a horse.,wndefs0.aiml
0,WNDEF DRIFTWOOD,*,*,Wood that is floating or that has been washed ashore.,wndefs0.aiml
0,WNDEF MOUTHFUL,*,*,The quantity that can be held in the mouth.,wndefs0.aiml
0,WNDEF ANTERIOR,*,*,Earlier in time; Of or near the head end or toward the front plane of the body.,wndefs0.aiml
0,WNDEF RADIO-CONTROLLED,*,*,Operated something and guided by radio.,wndefs0.aiml
0,WNDEF SCHERZO,*,*,A fast movement (usually in triple time).,wndefs0.aiml
0,WNDEF AFFRAY,*,*,Noisy quarrel; A noisy fight.,wndefs0.aiml
0,WNDEF SEDUCTIVE,*,*,Tending to entice into a desired action or state.,wndefs0.aiml
0,WNDEF SEBASTODES,*,*,Rockfishes.,wndefs0.aiml
0,WNDEF BUCKSKINS,*,*,Breeches made of buckskin.,wndefs0.aiml
0,WNDEF ANTISOCIAL,*,*,Shunning contact with others; Unwilling or unable to conform to normal standards of social behavior.,wndefs0.aiml
0,WNDEF RAWALPINDI,*,*,An ancient city in northeastern Pakistan; served as capital of Pakistan while Islamabad was being built.,wndefs0.aiml
0,WNDEF TRUST COMPANY,*,*,An organization (usually with a commercial bank) that is engaged as a trustee or fiduciary or agent in handling trust funds or estates of custodial arrangements or stock transfers or related services.,wndefs0.aiml
0,WNDEF REGURGITATION,*,*,Recall after rote memorization; Backflow of blood through a defective heart valve.,wndefs0.aiml
0,WNDEF STACKED HEEL,*,*,A heel made of many layers of leather.,wndefs0.aiml
0,WNDEF URBAN V,*,*,French pope from 1362 to 1370 who tried to reestablish the papacy in Rome but in 1367 returned to Avignon hoping to end the war between France and England; canonized in 1870 (1310-1370).,wndefs0.aiml
0,WNDEF TOTALIZE,*,*,Make something into a total.,wndefs0.aiml
0,WNDEF AUTO LIMITATION,*,*,Social control achieved as a manifestation of self-will or consent.,wndefs0.aiml
0,WNDEF CREAM PUFF,*,*,Puff filled with cream or custard.,wndefs0.aiml
0,WNDEF HUGOESQUE,*,*,In the manner of Victor Hugo.,wndefs0.aiml
0,WNDEF CYTOARCHITECTURAL,*,*,Of or relating to cytoarchitecture.,wndefs0.aiml
0,WNDEF DATABASE,*,*,An organized body of related information.,wndefs0.aiml
0,WNDEF OBSESS,*,*,Be preoccupied with something.,wndefs0.aiml
0,WNDEF TETRALOGY OF FALLOT,*,*,A congenital heart defect producing cyanosis; characterized by four symptoms.,wndefs0.aiml
0,WNDEF GENYONEMUS,*,*,A genus of Sciaenidae.,wndefs0.aiml
0,WNDEF CURVED,*,*,Having or marked by a curve or smoothly rounded bend.,wndefs0.aiml
0,WNDEF ANASTIGMATIC,*,*,Not astigmatic; Pertaining to a lens or lens system free of astigmatism (able to form point images).,wndefs0.aiml
0,WNDEF ADMINISTRATIVE HEARING,*,*,A hearing that takes place outside the judicial process before hearing examiners who have been granted judicial authority specifically for the purpose of conducting such hearings.,wndefs0.aiml
0,WNDEF CICHLIDAE,*,*,Cichlids.,wndefs0.aiml
0,WNDEF SNIFF OUT,*,*,Recognize or detect by or as if by smelling.,wndefs0.aiml
0,WNDEF CHARLOTTETOWN,*,*,The provincial capital and largest city of Prince Edward Island.,wndefs0.aiml
0,WNDEF THEOSOPHY,*,*,A system of belief based on mystical insight into the nature of God and the soul.,wndefs0.aiml
0,WNDEF MARSALA,*,*,Dark sweet or semisweet dessert wine from Sicily.,wndefs0.aiml
0,WNDEF DESUETUDE,*,*,A state of inactivity or disuse.,wndefs0.aiml
0,WNDEF KINGBIRD,*,*,Large American flycatcher.,wndefs0.aiml
0,WNDEF INSULATOR,*,*,A material such as glass or porcelain with negligible electrical or thermal conductivity.,wndefs0.aiml
0,WNDEF PRAKRITIC,*,*,Of or relating to Prakrit.,wndefs0.aiml
0,WNDEF INSTRUMENTAL ROLE,*,*,The semantic role of the entity (usually inanimate) that the agent uses to perform an action or start a process.,wndefs0.aiml
0,WNDEF SAN JUAN,*,*,The capital and largest city of Puerto Rico.,wndefs0.aiml
0,WNDEF COPE,*,*,Come to terms or deal successfully with something.,wndefs0.aiml
0,WNDEF HUNDRED-AND-EIGHTIETH,*,*,The ordinal number of one hundred eighty in counting order.,wndefs0.aiml
0,WNDEF INATTENTION,*,*,Lack of attention.,wndefs0.aiml
0,WNDEF UNDIGESTED,*,*,Not digested something; Not thought over and arranged systematically in the mind; not absorbed or assimilated mentally.,wndefs0.aiml
0,WNDEF PENTASTOMIDA,*,*,Tongue worms.,wndefs0.aiml
0,WNDEF CAMASSIA,*,*,Genus of scapose herbs of North and South America having large edible bulbs.,wndefs0.aiml
0,WNDEF CONDESCENDINGLY,*,*,With condescension; in a patronizing manner.,wndefs0.aiml
0,WNDEF PLUMBAGINACEOUS,*,*,Of or pertaining to or characteristic of plants of the family Plumbaginaceae.,wndefs0.aiml
0,WNDEF CROSSOVER,*,*,The appropriation of a new style (especially in popular music) by combining elements of different genres in order to appeal to a wider audience.,wndefs0.aiml
0,WNDEF GURNARD,*,*,Bottom-dwelling coastal fishes with spiny armored heads and fingerlike pectoral fins used for crawling along the sea bottom.,wndefs0.aiml
0,WNDEF CAUDEX,*,*,Woody stem of palms and tree ferns.,wndefs0.aiml
0,WNDEF STARDOM,*,*,The status of being acknowledged as a star.,wndefs0.aiml
0,WNDEF COPT,*,*,A member of the Coptic Church; An Egyptian descended from the ancient Egyptians.,wndefs0.aiml
0,WNDEF PERFUMER,*,*,A person who makes (and sells) perfumes.,wndefs0.aiml
0,WNDEF DROP ARCH,*,*,A blunt pointed arch drawn from two centers within the span.,wndefs0.aiml
0,WNDEF INCONVERTIBLE,*,*,Not capable of being changed into something else.,wndefs0.aiml
0,WNDEF VIDUA,*,*,Whydahs.,wndefs0.aiml
0,WNDEF COPY,*,*,Material suitable for a journalistic account; Make a replica of something; A secondary representation of an original; Matter to be printed; exclusive of graphical materials; Copy down as is.,wndefs0.aiml
0,WNDEF COUNTERFACTUAL,*,*,Going counter to the facts (usually as a hypothesis).,wndefs0.aiml
0,WNDEF COOL,*,*,Loose heat; Lose intensity; Make something cool or cooler; The quality of being cool; Marked by calm self-control (especially in trying circumstances); unemotional; Used of a number or sum and meaning without exaggeration or qualification; Neither warm nor very cold; giving relief from heat; Psychologically cool and unenthusiastic; unfriendly or unresponsive or showing dislike; Inducing the impression of coolness; used especially of greens and blues and violets.,wndefs0.aiml
0,WNDEF COOK,*,*,Someone who cooks food; Transform by heating; Prepare a hot meal; English navigator who claimed the east coast of Australia for Britain and discovered several Pacific islands (1728-1779); Transform and make suitable for consumption by heating; Prepare for eating by applying heat.,wndefs0.aiml
0,WNDEF COON,*,*,An eccentric or undignified rustic.,wndefs0.aiml
0,WNDEF LYING,*,*,The deliberate act of deviating from the truth.,wndefs0.aiml
0,WNDEF ADEQUATE,*,*,Meeting the requirements especially of a task; Enough to meet a purpose; About average; acceptable.,wndefs0.aiml
0,WNDEF DELICATESSEN,*,*,Ready-to-eat food products; A shop selling delicatessen (as salads or cooked meats).,wndefs0.aiml
0,WNDEF GULPING,*,*,The drinking of large mouthfuls rapidly.,wndefs0.aiml
0,WNDEF KIANG,*,*,Wild ass of Tibet and Mongolia.,wndefs0.aiml
0,WNDEF ACHILLEA,*,*,Any of several plants of the genus Achillea native to Europe and having small white flowers in flat-topped flower heads.,wndefs0.aiml
0,WNDEF HEIGHTENING,*,*,Reaching a higher intensity.,wndefs0.aiml
0,WNDEF COUNTERINTUITIVE,*,*,Contrary to what common sense would suggest.,wndefs0.aiml
0,WNDEF BABYMINDER,*,*,A woman who looks after babies in her own home while their parents are working.,wndefs0.aiml
0,WNDEF PULL UP SHORT,*,*,Stop abruptly.,wndefs0.aiml
0,WNDEF REFLOAT,*,*,Set afloat again.,wndefs0.aiml
0,WNDEF LIPOPHILIC,*,*,Having an affinity for lipids.,wndefs0.aiml
0,WNDEF COOT,*,*,Slate-black slow-flying birds somewhat resembling ducks.,wndefs0.aiml
0,WNDEF IMPORTUNITY,*,*,Insistent solicitation and entreaty.,wndefs0.aiml
0,WNDEF BARBETTE CARRIAGE,*,*,A gun carriage elevated so that the gun can be fired over the parapet.,wndefs0.aiml
0,WNDEF EXODONTICS,*,*,The branch of dentistry dealing with extraction of teeth.,wndefs0.aiml
0,WNDEF HODOSCOPE,*,*,Scientific instrument that traces the path of a charged particle.,wndefs0.aiml
